movie_id,title,original_title,original_language,release_date,runtime,budget,revenue,vote_average,vote_count,popularity,genres,production_companies,production_countries,release_year,release_month,director,actors
541905,우리를 갈라놓는 것들,우리를 갈라놓는 것들,ko,2019-11-28,100,0,0,0.0,0,1.2654,"['역사', '다큐멘터리']","['Atnine Film', 'BANDAL Doc.']",['KR'],2019.0,11.0,Im Heung-soon,"Jeong Jeong Hwa, Kim Dong-il, Go Gye-yeon, Yoon Soo-ryeon, Kang Na-ra"
542482,착한 장모,착한 장모,ko,2017-08-08,0,0,0,0.0,0,1.0021,[],[],[],2017.0,8.0,,"Ah Ri, Han So-yeon-I (한소연), Jung Jae-sik (정재식)"
542836,협상,협상,ko,2018-09-19,114,0,15229193,7.076,152,1.3295,"['범죄', '액션', '스릴러']","['JK Film', 'CJ Entertainment']",['KR'],2018.0,9.0,Lee Jong-suk,"Son Ye-jin, Hyun Bin, Kim Sang-ho, Jang Young-nam, Jang Kwang"
542969,배반의 장미,배반의 장미,ko,2018-10-18,99,0,0,4.4,5,0.7449,['코미디'],"['Lotte Entertainment', 'Taewon Entertainment', 'The Lot Pictures', 'Finecut']",['KR'],2018.0,10.0,Park Jin-young,"Kim In-kwon, Jung Sang-hoon, Son Dam-bi, Kim Sung-cheol, Park Cheol-min"
543018,밀애 : 부부카풀,밀애 : 부부카풀,ko,2018-06-28,71,0,0,4.0,2,0.961,['로맨스'],[],[],2018.0,6.0,Lim Hyun-tae,"Seo Won, Lee Joon-hyun, Kang Dae-ho, Jin Joo"
543032,슬픈 씬,슬픈 씬,ko,2015-03-10,5,0,0,0.0,0,0.9506,['로맨스'],[],[],2015.0,3.0,Woo Moon-gi,"Ahn Jae-hong, Lee Na-young"
543624,영화과를 졸업한 언니들과 나,영화과를 졸업한 언니들과 나,ko,2018-08-22,20,0,0,0.0,0,0.0214,['다큐멘터리'],[],[],2018.0,8.0,Her Yoon-soo,
543753,상류사회,상류사회,ko,2018-08-29,120,0,4300000,5.5,51,3.2605,['드라마'],['Hive Media Corp'],['KR'],2018.0,8.0,Byun Hyuk,"Park Hae-il, Soo Ae, Yoon Je-moon, Ra Mi-ran, Lee Jin-uk"
544007,젊은 처형: 그녀를 탐하다,젊은 처형: 그녀를 탐하다,ko,2018-07-11,61,0,0,4.0,1,0.2035,[],[],[],2018.0,7.0,Kang Jung Hoon,"Tamaki Mai, Takeshita Nana"
544089,명당,명당,ko,2018-09-19,126,0,64147,7.2,17,1.7467,"['드라마', '역사']","['Jupiter Film', 'Plus M Entertainment', 'Little Big Pictures']",['KR'],2018.0,9.0,Park Hee-kon,"Cho Seung-woo, Ji Sung, Kim Sung-kyun, Baek Yoon-sik, Moon Chae-won"
544148,"만나게 해, 주오","만나게 해, 주오",ko,2017-09-10,65,0,0,4.0,1,0.3866,"['드라마', '코미디']",[],['KR'],2017.0,9.0,,"Son Ho-jun, Cho Bo-ah, Baek Soo-jang, Cho Jae-ryong, Kwon Soo-hyun"
544387,카오산 탱고,카오산 탱고,ko,2020-07-30,97,0,0,5.0,1,0.3127,"['드라마', '로맨스']",['gram FILMS'],['KR'],2020.0,7.0,Kim Beom-sam,"Hong Wan-pyo, Hyunri, Oh Chang-kyung, Sow Hirosawa, Takashi Yuki"
544544,내겐 너무 귀여운 그대,내겐 너무 귀여운 그대,ko,2016-09-02,11,0,0,0.0,0,0.0875,['로맨스'],[],[],2016.0,9.0,Park Yeon-soo,"Lee Kyung-won, Park Se-hyun"
544553,두근두근 영춘권,두근두근 영춘권,ko,2010-11-05,4,0,0,0.0,0,0.1576,"['코미디', '로맨스']",[],[],2010.0,11.0,Park Jae-min,"Park Hee-von, Cho Hyun-chul"
544583,엄마 친구 : 그녀의 섹스고백 무삭제판,엄마 친구 : 그녀의 섹스고백 무삭제판,ko,2018-01-09,79,0,0,3.8,2,0.4657,"['드라마', '로맨스']",[],[],2018.0,1.0,Choi Kang-ho,Minori Kotani
544627,암수살인,암수살인,ko,2018-10-03,110,7120949,29433930,6.628,86,1.0853,"['범죄', '드라마']","['Film 295', 'Blossom Pictures', 'Showbox']",['KR'],2018.0,10.0,Kim Tae-gyoon,"Kim Yun-seok, Ju Ji-hoon, Moon Jeong-hee, Jin Sun-kyu, Jeong Jong-jun"
544814,미쓰백,미쓰백,ko,2018-10-11,98,0,5400000,7.4,48,1.6609,"['드라마', '스릴러', '범죄']","['Bae Pictures', 'Little Big Pictures', 'CJ Entertainment']",['KR'],2018.0,10.0,Lee Ji-won,"Han Ji-min, Kim Si-a, Lee Hee-jun, Kwon So-hyun, Baek Soo-jang"
544948,바보야,바보야,ko,2011-04-21,73,0,0,8.0,1,0.1821,['다큐멘터리'],[],[],2011.0,4.0,Kang Sung-ok,"Ahn Sung-ki, Kim Sou-hwan"
544949,보통날,보통날,ko,2011-12-28,14,0,0,0.0,0,0.0505,['로맨스'],[],[],2011.0,12.0,Ga-hee Chae,
545089,"소녀, 보다","소녀, 보다",ko,2014-09-25,2,0,0,0.0,0,0.0143,[],[],[],2014.0,9.0,Choi Hyung-Kyu,
545281,첫사랑 열전,첫사랑 열전,ko,2010-05-05,114,0,0,0.0,0,0.9959,"['드라마', '로맨스']",[],['KR'],2010.0,5.0,Park Bum-Hoon,"Lee Chung-ah, Ryu Hyun-kyung, Jung Ae-yeun, Kim Sung-gon, Kim Dong-gon"
545407,양아치 느와르,양아치 느와르,ko,2018-09-13,128,0,0,4.5,2,1.2473,"['드라마', '코미디']",[],['KR'],2018.0,9.0,Kang Hyo-jin,"Kim Byung-chul, Kwak Ji-yoo, Kim Young Yong, Nam Jin-bok, Seo Seung-won"
545424,여자만화구두 극장판,여자만화구두 극장판,ko,2014-05-29,119,0,0,1.5,4,0.2496,"['로맨스', '드라마']",[],[],2014.0,5.0,An Gil-ho,"Han Seung-yeon, Hong Jong-hyun, Jung Ga-eun, Yoon Jong-hoon"
545430,욕,욕,ko,2011-10-02,5,0,0,0.0,0,0.0478,[],[],[],2011.0,10.0,Park Sung-kwang,Park Sung-kwang
545937,아워 바디,아워 바디,ko,2018-10-05,94,0,0,5.385,13,0.4592,['드라마'],"['Korean Academy of Film Arts', 'Korean Film Council', 'Jinjin Pictures']",['KR'],2018.0,10.0,Han Ka-ram,"Choi Hee-seo, Ahn Ji-hye, Kim Jung-young, Lee Jae-in, Choi Jun-young"
546103,생산적 활동,생산적 활동,ko,2006-04-01,97,0,0,3.0,1,0.0418,"['로맨스', '스릴러']",[],[],2006.0,4.0,Oh Jeom-gyun,"Lee Eung-jae, Jang Gyung-jin, Lee Min-a"
546287,타클라마칸,타클라마칸,ko,2018-03-22,107,0,0,5.167,6,1.1752,['드라마'],['Cine Factory'],['KR'],2018.0,3.0,Ko Eun-ki,"Cho Seong-ha, Ha Yoon-kyung, Song Seo-yool, Gong Sang-a, Jang Bong-soo-I"
546487,뷰티풀 데이즈,뷰티풀 데이즈,ko,2018-11-21,104,0,0,6.8,19,0.9172,['드라마'],"['Peppermint & Company', 'Zorba Production', 'kth', 'Contents Panda', 'Smile Ent.']","['FR', 'KR']",2018.0,11.0,Jéro Yun,"Lee Na-young, Jang Dong-yoon, Oh Kwang-rok, Lee Yoo-jun, Seo Hyun-woo"
546493,군산: 거위를 노래하다,군산: 거위를 노래하다,ko,2018-11-08,122,0,0,8.2,18,0.7231,['드라마'],"['Lu Film', 'Michigan Venture Capital', 'Triple Pictures', 'White Picture']",['KR'],2018.0,11.0,Zhang Lu,"Park Hae-il, Moon So-ri, Jung Jin-young, Park So-dam, Dong Bang-woo"
546589,기도하는 남자,기도하는 남자,ko,2020-02-20,111,0,0,6.7,3,0.4625,"['드라마', '가족', '범죄']",['Film Company YOUN'],['KR'],2020.0,2.0,Kang Dong-hun,"Park Hyuk-kwon, Ryu Hyun-kyung, Nam Kee-ae, Baek Jong-seung, Oh Dong-min"
546592,늦여름,늦여름,ko,2018-10-25,93,0,0,6.2,4,0.1944,['가족'],[],['KR'],2018.0,10.0,Cho Sung-kyu,"Im Won-hee, Shin So-yul, Jun Suk-ho, Jeong Yeon-joo, Heo Dong-won"
546594,막다른 골목의 추억,막다른 골목의 추억,ko,2019-04-04,90,0,0,6.8,6,0.5977,"['드라마', '로맨스']",['Zoa Films'],"['JP', 'KR']",2019.0,4.0,Choi Hyun-young,"Sooyoung Choi, Shunsuke Tanaka, Ahn Bo-hyun, Kaoru Hirata, Bae Noo-ri"
546596,카센타,카센타,ko,2019-11-27,98,0,0,6.4,6,0.6663,"['코미디', '범죄']",['Triple Pictures'],['KR'],2019.0,11.0,Ha Yoon-jae,"Park Yong-woo, Cho Eun-ji, Hyun Bong-sik, Kim Han-jong, Han Soo-yeon"
546597,속물들,속물들,ko,2019-12-12,108,0,0,6.0,2,1.1193,"['드라마', '범죄']","['300 & Co.', 'Jupiter Film']",['KR'],2019.0,12.0,Shin A-ga,"Yoo Da-in, Sim Hee-seop, Song Jae-rim, Ok Ja-yeon, You Chea-myung"
546657,폴란드로 간 아이들,폴란드로 간 아이들,ko,2018-10-31,79,0,0,10.0,2,0.1881,['다큐멘터리'],"['Contents Panda', 'Connect Pictures']",['KR'],2018.0,10.0,Chu Sang-mi,Chu Sang-mi
546767,영주,영주,ko,2018-11-22,101,0,0,5.9,7,0.6976,['드라마'],['CGV Arthouse'],['KR'],2018.0,11.0,Cha Sung-duk,"Kim Hyang-gi, Kim Ho-jung, You Chea-myung, Tang Joon-sang, Jang Hye-jin"
546768,메기,메기,ko,2019-09-26,88,0,0,7.6,20,1.1033,"['드라마', '코미디']","['National Human Rights Commission of Korea', 'Atnine Film', 'CGV Arthouse', '2X9']",['KR'],2019.0,9.0,Yi Ok-seop,"Lee Joo-young, Koo Kyo-hwan, Moon So-ri, Chun Woo-hee, Park Kyung-hye"
546772,계절과 계절 사이,계절과 계절 사이,ko,2018-10-05,98,0,0,5.8,5,0.9508,"['로맨스', '드라마']",['Korea National University of Arts'],['KR'],2018.0,10.0,Kim Jun-sik,"Lee Yeong-jin, Yoon Hye-ree, Kim Young-min, Oh Ha-ni, Jeong Eun-gyeong"
546775,돌멩이,돌멩이,ko,2020-10-15,108,0,0,7.2,5,1.4833,['드라마'],"['Zip Cinema', 'kth', 'Studio Take']",['KR'],2020.0,10.0,Kim Jeong-sik,"Kim Dae-myung, Song Yun-ah, Kim Eui-sung, Jeon Chae-eun, Kim Young-jae"
546932,사내본색,사내본색,ko,2018-08-29,97,0,0,5.0,2,1.0116,"['드라마', '코미디']",[],[],2018.0,8.0,Lee Si-u,"Heo Sung-tae, Seol Jae-geun, Cho Seong-hui, Ban Eun-se, Geum Hannah"
546934,그림자 먹는 개,그림자 먹는 개,ko,2018-06-28,80,0,0,5.0,1,0.5564,['드라마'],[],['KR'],2018.0,6.0,Choi Na-ni,"Seo Gap-suk, Kim Nam-o, Bang Joong-Hyun, Min Kyung-jin"
547193,아카이브의 유령들,아카이브의 유령들,ko,2014-06-14,33,0,0,0.0,0,0.5698,['드라마'],['Korean Film Archive'],['KR'],2014.0,6.0,Kim Jong-kwan,"Jo Hee-bong, Cha Jin-yeob, Moon So-ri, Han Yeri, Kwon Yul"
547222,아이들,아이들,ko,2008-06-26,32,0,0,0.0,0,0.1283,['드라마'],[],['KR'],2008.0,6.0,Yoon Sung-hyun,"Koo Kyo-hwan, Lee Min-woong, Kim Si-kwon"
547272,그녀의 전설,그녀의 전설,ko,2015-10-07,27,0,0,0.0,0,0.6071,"['드라마', '가족']",[],['KR'],2015.0,10.0,Kim Tae-yong,"Choi Kang-hee, Eun hee"
547328,반신반의,반신반의,ko,2018-03-09,31,0,0,0.0,0,1.5385,"['드라마', '스릴러', '액션']","['Moho Film', 'Asia Culture Center']",['KR'],2018.0,3.0,Park Chan-kyong,"Lee Min-ji, Oh Tae-kyung, Uhm Hyo-seop, Park Ji-hwan, Yang Hyun-min"
547360,"온더로드, 투","온더로드, 투",ko,2006-01-05,107,0,0,6.0,1,0.0857,"['다큐멘터리', '음악']",['Sponge'],['KR'],2006.0,1.0,Kim Tae-yong,
547397,호흡,호흡,ko,2019-12-19,104,0,0,6.833,6,0.5171,['드라마'],"['Korean Academy of Film Arts', 'Korean Film Council', 'gram FILMS']",['KR'],2019.0,12.0,Kwon Man-ki,"Yoon Ji-hye, Kim Dae-gun, Kim Su-hyun, Kim Ga-young, Kwak Ja-hyung"
547403,선희와 슬기,선희와 슬기,ko,2019-03-27,70,0,0,7.1,19,0.6113,['드라마'],"['Korea National University of Arts', 'Little Big Pictures']",['KR'],2019.0,3.0,Park Young-ju,"Jeong Da-eun, Park Soo-yeon, Jeon Guk-hyang, Kim Jae-hwa, Jang Hye-jin"
547404,벌새,벌새,ko,2019-08-28,139,0,1041948,7.6,106,1.3726,['드라마'],"['Contents Panda', 'Mass Ornament Films', 'Epiphany Film']",['KR'],2019.0,8.0,Kim Bora,"Park Ji-hu, Kim Sae-byuk, Seol Hye-in, Jeong In-gi, Lee Seung-yeon"
547437,일진 2,일진 2,ko,2018-10-04,80,0,0,0.0,0,0.5779,['액션'],['Lee Film'],['KR'],2018.0,10.0,Lee Soo-sung,"Lee Seung-yong, Yoon Seon-geun, Byun Jun-woo, Yeo Joo-young, Song Bo-bae"
547507,딥,딥,ko,2018-09-06,85,0,0,0.0,0,0.566,"['스릴러', '로맨스']",[],['KR'],2018.0,9.0,Cho Sung-kyu,"Choi Yeo-jin, Ryu Seung-su, Heo Dong-won, Ahn Ji-hye, Kwak Jin-seok"
547605,맞짱,맞짱,ko,2018-09-06,109,0,0,3.0,1,0.3454,['액션'],[],[],2018.0,9.0,Cha Ryong,"Choe Tae-Hwan, Yang Eun-yong, Seo In-seok, Cha Ryong, Park Yeong-rok"
547695,눈부신 하루,눈부신 하루,ko,2006-02-24,133,0,0,3.5,2,0.6013,"['로맨스', '드라마']","['Korean Film Council', 'Indiestory']",['KR'],2006.0,2.0,Kim Jong-kwan,"Kim Joo-ryoung, Lee So-yeon, Kiki Sugino, Jo Hee-bong, Yoo Chae-mok"
547991,멀리가지마라,멀리가지마라,ko,2021-03-04,75,0,0,6.3,3,1.0938,"['드라마', '범죄']","['(주)파노라마이엔티', '영화사 야경꾼']",['KR'],2021.0,3.0,Park Hyun-yong,"Son Byung-ho, Son Jin-hwan, Park Myung-shin, Ji Dae-han, Yoon Eun-byul"
548096,더 블랙,더 블랙,ko,2018-09-13,68,0,0,0.0,0,1.3117,['다큐멘터리'],['Anares'],['KR'],2018.0,9.0,Mario Lee,"Park Geun-hye, Moon Jae-in, Sohn Suk-hee, Yoon Suk-yeol, Kim Joong-ki"
548273,뷰티풀 투모로우,뷰티풀 투모로우,ko,2017-10-26,68,0,0,0.0,0,0.2518,['드라마'],['CJ CGV'],['KR'],2017.0,10.0,JANG Jae-hyuk,"Park Hyo-shin, Jung Jae-il"
548352,완벽한 타인,완벽한 타인,ko,2018-10-31,115,0,0,7.2,50,1.3951,"['드라마', '코미디']","['Lotte Entertainment', 'Film Monster', 'CJ Entertainment', 'DramaHouse', 'JTBC Studios']",['KR'],2018.0,10.0,JQ Lee,"Yoo Hai-jin, Cho Jin-woong, Lee Seo-jin, Yum Jung-ah, Kim Ji-soo"
548572,극장판 뽀잉: 슈퍼 변신의 비밀,극장판 뽀잉: 슈퍼 변신의 비밀,ko,2018-09-20,72,0,0,7.0,1,0.1838,"['애니메이션', '모험']",['CrazyBird Studio'],['KR'],2018.0,9.0,Jung Mi Hwa,"Jeon Tae-yeol, Um Sang-hyun"
548792,색화동,색화동,ko,2007-09-15,72,0,0,6.5,3,1.3955,"['코미디', '드라마']",[],[],2007.0,9.0,Kong Ja-kwan,"Cho Jae-wan, Kim Dong-soo, Jeong So-jin, Kim Yang-hoon, Jang Tae-seong"
549362,슈퍼문,슈퍼문,ko,2021-09-09,80,0,0,5.0,1,0.0588,['애니메이션'],[],['KR'],2021.0,9.0,Hong Dae-yeong,
549442,경계에 선 인생,경계에 선 인생,ko,2009-03-30,76,0,0,0.0,0,0.0214,[],[],[],2009.0,3.0,Jung Chang-Young,No Chon
549590,동네사람들,동네사람들,ko,2018-11-07,99,0,3388675,7.4,77,3.6535,"['액션', '범죄', '스릴러', '미스터리']","['Little Big Pictures', 'Daydream', 'CJ Entertainment']",['KR'],2018.0,11.0,Im Jin-soon,"Don Lee, Kim Sae-ron, Jang Kwang, Lee Sang-yeob, Shin Se-hwi"
549649,귀신과 함께 춤을,귀신과 함께 춤을,ko,2018-09-27,70,0,0,3.0,1,1.5994,"['판타지', '드라마', '코미디']","['Infinity Entertainment Co., Ltd.']",['KR'],2018.0,9.0,Director Baek,"Lee Kwang-hoon, Ju Min-ha, Jung Joo-ri, Hong Hae-sol, Geum Na-rang"
549855,마왕의 딸 이리샤,마왕의 딸 이리샤,ko,2018-11-29,84,0,0,0.0,0,0.29,['애니메이션'],"['Korean Academy of Film Arts', 'Korean Film Council', 'Sidus', '300 & Co.']",['KR'],2018.0,11.0,Chang Hyung-yun,"Chun Woo-hee, Sim Hee-seop, Lee Ga-kyung"
550495,부서진 밤,부서진 밤,ko,2010-10-10,23,0,0,6.0,1,0.6095,"['드라마', '스릴러']",['Korea National University of Arts'],['KR'],2010.0,10.0,Yang Hyo-joo,"Han Joo-wan, Jeong In-gi, Lee Min-ji"
550507,매니멀즈,매니멀즈,ko,2017-09-23,5,0,0,0.0,0,0.0071,"['애니메이션', '코미디']","['Korea Creative Content Agency', 'Korea Independent Animation Filmakers Association (KIAFA)']",['KR'],2017.0,9.0,Jihyeon Oh,"Young-ki Lee, Yang-uk Jin"
550628,라스트 씬,라스트 씬,ko,2019-12-12,91,0,0,0.0,0,0.0518,['다큐멘터리'],"['Cinema Dal', 'Ozi Film']",['KR'],2019.0,12.0,Park Bae-il,
551387,보희와 녹양,보희와 녹양,ko,2019-05-29,102,0,0,6.7,3,1.9245,"['드라마', '코미디']","['KT&G Sangsangmadang', 'Korean Academy of Film Arts', 'Korean Film Council']",['KR'],2019.0,5.0,Ahn Ju-young,"Ahn Ji-ho, Kim Ju-a, Shin Dong-mi, Seo Hyun-woo, Kim So-ra"
551655,해피 투게더,해피 투게더,ko,2018-11-15,111,0,0,7.0,3,0.6409,"['드라마', '코미디']","['Golden Story Pictures', 'Semicolon Studio']",['KR'],2018.0,11.0,Kim Jeong-hwan,"Park Sung-woong, Song Sae-byuk, Choi Ro-woon, Han Sang-hyuk, Kwon Hae-hyo"
552632,애인 : 아내의 남자,애인 : 아내의 남자,ko,2018-06-21,72,0,0,8.0,4,1.2211,['로맨스'],[],[],2018.0,6.0,Lim Hyun-tae,"Seo Won, Lee Joon-hyun, Kang Dae-ho, Lee Jin-joo-I, Jin Joo"
552663,걷기 좋은 날,걷기 좋은 날,ko,2018-10-11,102,0,0,0.0,0,0.1402,['드라마'],[],['KR'],2018.0,10.0,Bae Yong-joo,"Jo Choon-ho, Park Ji-yeon, Yoon Hae-min, Kim Sae-byuk, Oh Jin-ha"
552693,녹차의 중력,녹차의 중력,ko,2019-11-28,130,0,0,0.0,0,0.3208,['다큐멘터리'],['KINO'],['KR'],2019.0,11.0,Jung Sung-il,Im Kwon-taek
552695,백두 번째 구름,백두 번째 구름,ko,2019-12-26,166,0,0,0.0,0,0.2011,['다큐멘터리'],[],['KR'],2019.0,12.0,Jung Sung-il,Im Kwon-taek
552710,우는 여자,우는 여자,ko,2014-03-09,69,0,0,6.0,1,0.1514,['드라마'],[],['KR'],2014.0,3.0,Lee Eun-jin,"Kim You-jung, Seo Jun-young, Hwang Miseon"
552802,뷰티풀 보이스,뷰티풀 보이스,ko,2019-05-22,96,0,0,8.0,2,0.4789,['코미디'],"['Storm Pictures Korea', 'Wide Release']",['KR'],2019.0,5.0,Kim Sun-ung,"Park Ho-san, Lee Yi-kyung, Moon Ji-in, Bae Yu-ram, Yeon Je-wook"
553277,연무,연무,ko,2015-11-26,42,0,0,0.0,0,0.0589,['드라마'],[],[],2015.0,11.0,Choi Si-hyung,
553350,여곡성,여곡성,ko,2018-11-08,94,0,0,5.818,22,2.2666,"['공포', '미스터리', '역사']","['Smile Ent.', 'Monster Factory', 'Contents Panda']",['KR'],2018.0,11.0,Yoo Young-seon,"Seo Young-hee, Son Na-eun, Lee Tae-ri, Park Min-ji, Choi Hong-il"
553447,집의 시간들,집의 시간들,ko,2018-10-25,72,0,0,0.0,0,0.0588,['다큐멘터리'],['KT&G Sangsangmadang'],['KR'],2018.0,10.0,Raya,
553500,우리,우리,ko,2018-04-19,62,0,0,4.333,3,0.639,['드라마'],['Spektakulativ'],"['DE', 'KR', 'TW', 'US']",2018.0,4.0,Lior Shamriz,"Kim Won-mok, Kwon Ki-ha, Ming Maa, Won Teehee, Theodore Bouloukos"
553512,번 더 스테이지: 더 무비,번 더 스테이지: 더 무비,ko,2018-11-15,83,0,0,8.363,423,1.5559,"['음악', '다큐멘터리']","['Big Hit Entertainment', 'The Walt Disney Company Korea', 'Camp Entertainment']",['KR'],2018.0,11.0,Park Jun-soo,"RM, Jin, Suga, j-hope, Jimin"
554136,출국,출국,ko,2018-11-14,105,0,0,3.3,3,1.8855,['드라마'],['D.seeD'],['KR'],2018.0,11.0,Noh Gyoo-yeob,"Lee Beom-soo, Yeon Woo-jin, Park Hyuk-kwon, Park Joo-mi, Lee Jong-hyuk"
554137,국가부도의 날,국가부도의 날,ko,2018-11-28,114,0,0,6.9,58,0.8666,"['드라마', '역사']","['Zip Cinema', 'CJ Entertainment']",['KR'],2018.0,11.0,Choi Kook-hee,"Kim Hye-soo, Yoo Ah-in, Huh Joon-ho, Jo Woo-jin, Vincent Cassel"
554140,동화,동화,ko,2018-10-25,84,0,0,10.0,1,0.5791,['드라마'],[],['KR'],2018.0,10.0,Son Il-seong,"Seo Young-joo, Han Bo-bae"
554500,"이,기적인 남자","이,기적인 남자",ko,2018-10-25,95,0,0,5.0,2,0.3756,['드라마'],['Bridge Production'],['KR'],2018.0,10.0,Kim Jae-sik,"Park Ho-san, Choi Yu-ha, Jo Eun-bit, Hwang Sung-joon"
554509,얼굴없는 보스,얼굴없는 보스,ko,2019-11-21,102,0,0,2.2,4,2.1787,"['액션', '범죄', '드라마']",[],['KR'],2019.0,11.0,Song Chang-yong,"Chun Jung-myung, Jin Yi-han, Lee Ha-yul, Kwak Hee-Sung, Lee Xia"
554524,영하의 바람,영하의 바람,ko,2019-11-14,109,0,0,6.0,1,2.4273,"['가족', '드라마']","['Jinjin Pictures', 'The Secret Garden', 'Bridge Production']",['KR'],2019.0,11.0,Kim Yu-ri,"Kwon Han-sol, Ok Su-boon, Shin Dong-mi, Park Jong-hwan"
554779,스윙키즈,스윙키즈,ko,2018-12-14,133,0,0,8.091,77,1.696,"['드라마', '전쟁']","['Annapurna Films', 'Next Entertainment World']",['KR'],2018.0,12.0,Kang Hyoung-chul,"Doh Kyung-soo, Jared Grimes, Park Hye-su, Oh Jung-se, Kim Min-ho"
554908,엔딩스 비기닝스,"Endings, Beginnings",en,2020-06-24,110,0,0,6.116,249,2.2243,"['로맨스', '드라마']",['CJ Entertainment'],['KR'],2020.0,6.0,Drake Doremus,"Shailene Woodley, Jamie Dornan, Sebastian Stan, Matthew Gray Gubler, Lindsay Sloane"
554972,성난황소,성난황소,ko,2018-11-22,116,0,9512390,7.4,178,4.0582,"['범죄', '액션', '스릴러', '코미디']","['BA Entertainment', 'PLUSMedia Entertainment', 'Showbox']",['KR'],2018.0,11.0,Kim Min-ho,"Don Lee, Song Ji-hyo, Kim Seung-o, Kim Min-jae, Park Ji-hwan"
554989,숨바꼭질,숨바꼭질,ko,2014-12-18,49,0,0,5.0,1,0.0441,"['스릴러', '드라마']",['Indiestory'],['KR'],2014.0,12.0,Lee Han-uk,"Yu Byung-seon, Yu Sang-jae, Hwang Yun-jeong"
556134,60일의 썸머,60일의 썸머,ko,2018-10-25,94,0,0,6.5,2,0.8351,['미스터리'],['Hanyoung Culture & Technology'],['KR'],2018.0,10.0,Kim Hee-young,"Jang Kwang, Yeon Jun-seok, Ahn Seung-gyun, Sim Eun-woo, Hong Yoon-hee"
556509,사바하,사바하,ko,2019-02-20,122,0,17607783,6.797,192,1.8258,"['공포', '미스터리', '스릴러', '범죄']","['Filmmaker R&K', 'CJ Entertainment', 'filmK']",['KR'],2019.0,2.0,Jang Jae-hyun,"Lee Jung-jae, Park Jeong-min, Lee Jae-in, Yoo Ji-tae, Jung Jin-young"
557751,다영씨,다영씨,ko,2018-12-06,60,0,0,0.0,0,0.0733,['코미디'],['Indiestory'],['KR'],2018.0,12.0,Ko Bong-soo,Shin Min-jae
557968,리벤져,리벤져,ko,2018-12-06,102,0,0,5.564,163,3.2288,"['액션', '범죄', '스릴러']","['Green Fish Pictures', 'Little Big Pictures', 'Landmark Asia Holdings', 'Musa Productions']",['KR'],2018.0,12.0,Lee Seung-Won,"Bruce Khan, Park Hee-soon, Yoon Jin-seo, Kim In-kwon, Kim Na-yeon"
557972,PMC: 더 벙커,PMC: 더 벙커,ko,2018-12-26,124,0,0,6.9,117,1.1537,"['액션', '스릴러']","['CJ Entertainment', 'Perfect Storm Film']",['KR'],2018.0,12.0,Kim Byung-woo,"Ha Jung-woo, Lee Sun-kyun, Jennifer Ehle, Kevin Durand, Kang Shin-chul"
558712,꿈속에서,꿈속에서,ko,2007-01-01,19,0,0,0.0,0,0.4134,[],[],['KR'],2007.0,1.0,Jang Kun-jae,
558716,금지된 장난,금지된 장난,ko,2007-01-01,21,0,0,0.0,0,0.0214,[],[],['KR'],2007.0,1.0,Choi Min-Seok,
558718,난지도,난지도,ko,2007-01-01,15,0,0,0.0,0,0.0362,[],[],['KR'],2007.0,1.0,Lee Min-woo,
558719,동사무소 가는 길,동사무소 가는 길,ko,2007-01-01,18,0,0,0.0,0,0.08,[],[],['KR'],2007.0,1.0,Seo Min-soo,
558721,만남,만남,ko,2007-01-01,20,0,0,0.0,0,0.0621,[],[],['KR'],2007.0,1.0,Hong Sung-hoon,
558722,양희숙 생존기,양희숙 생존기,ko,2007-01-01,21,0,0,0.0,0,0.0071,[],[],['KR'],2007.0,1.0,Kim Hyun-Sung,
558725,유령소나타,유령소나타,ko,2007-01-01,42,0,0,0.0,0,0.0143,[],[],['KR'],2007.0,1.0,Ahn Sun-kyung,
558735,프랑스 중위의 여자,프랑스 중위의 여자,ko,2007-01-01,21,0,0,0.0,0,0.2346,[],['Korean Academy of Film Arts'],['KR'],2007.0,1.0,Baek Seung-bin,Kim Sang-hyun
558738,피는 멈추지 않는다,피는 멈추지 않는다,ko,2007-01-01,40,0,0,0.0,0,0.0261,[],[],['KR'],2007.0,1.0,Kim Seung-hyun,
559862,기억의 전쟁,기억의 전쟁,ko,2020-02-27,88,0,0,10.0,1,0.1046,['다큐멘터리'],"['Cinema Dal', 'Whale Films']",['KR'],2020.0,2.0,Lee-Kil Bora,
560490,왕초와 용가리,왕초와 용가리,ko,2016-09-08,0,0,0,6.0,1,0.0615,[],[],[],2016.0,9.0,Lee Chang-jun,
560524,인어전설,인어전설,ko,2016-01-01,107,0,0,6.0,3,0.2252,"['코미디', '드라마']","['Mirospace', 'Japari Film']",['KR'],2016.0,1.0,O Muel,"Jeon Hye-bin, Moon Hee-kyung, Lee Kyung-joon, Kang Rae-yeon, Sung Min-chul"
560525,리스펙트,리스펙트,ko,2018-11-28,98,0,0,0.0,0,1.8808,['다큐멘터리'],['Contents Panda'],['KR'],2018.0,11.0,Sim Jae-hee,"The Quiett, Dok2, Deepflow, MC Meta, Beenzino"
560527,내안의 그놈,내안의 그놈,ko,2019-01-09,122,0,14651772,7.81,142,3.2235,"['판타지', '코미디', '액션']","['The Contents On', 'EchoFilm', 'Merry Christmas', 'The Pictures with a View', 'Finecut']",['KR'],2019.0,1.0,Kang Hyo-jin,"Jung Jin-young, Park Sung-woong, Ra Mi-ran, Lee Soo-min, Kim Kwang-kyu"
561210,하나식당,하나식당,ko,2018-11-22,95,0,0,5.5,2,0.743,['드라마'],['Only One Movie'],['KR'],2018.0,11.0,Choi Nak-hee,"Choi Jung-won, Na Hye-mi, YOOHYEON, Choi YounHee, Ko yu an"
561219,런닝맨: 풀룰루의 역습,런닝맨: 풀룰루의 역습,ko,2018-12-06,69,0,0,8.0,1,1.5328,"['애니메이션', '모험', '액션']","['Seoul Broadcasting System', 'Next Entertainment World', 'LOCUS Corporation']",['KR'],2018.0,12.0,Jun-sang Yun,"Kim Seo-young, Um Sang-hyun, Kim Yeon-woo, Kwon Chang-uk, Kang Shi-hyun"
561594,트와이스랜드,트와이스랜드,ko,2018-12-07,109,0,186078,8.333,3,0.124,"['음악', '다큐멘터리']","['JYP Entertainment', 'CJ CGV']",['KR'],2018.0,12.0,Park Jin-young,"NAYEON, JEONGYEON, MOMO, SANA, JIHYO"
561974,점박이 한반도의 공룡 2: 새로운 낙원,점박이 한반도의 공룡 2: 새로운 낙원,ko,2019-12-25,94,0,0,7.8,120,1.1555,"['애니메이션', '모험']","['Dream Search Contents and Company co.Ltd', 'Korea Educational Broadcasting System (EBS)', 'Next Entertainment World']",['KR'],2019.0,12.0,Han Sang-ho,"Park Hee-soon, Ra Mi-ran, Kim Sung-kyun, Kim Eung-soo, Park Jung-geum"
562443,극장판 공룡메카드: 타이니소어의 섬,극장판 공룡메카드: 타이니소어의 섬,ko,2019-01-10,71,0,0,0.0,0,0.3262,"['애니메이션', '모험', 'SF']",['Choirock Contents Factory'],['KR'],2019.0,1.0,Choe Shin-gyu,
563103,도어락,도어락,ko,2018-12-05,102,0,11,7.446,148,1.6224,"['스릴러', '범죄', '미스터리']","['Plus M Entertainment', 'Studio Pieona']",['KR'],2018.0,12.0,Lee Kwon,"Gong Hyo-jin, Kim Ye-won, Kim Seung-o, Jo Bok-rae, Lee Ga-sub"
564863,말모이,말모이,ko,2019-01-09,135,0,0,7.8,26,1.206,"['드라마', '코미디', '역사']","['The LAMP', 'Lotte Entertainment']",['KR'],2019.0,1.0,Eom Yu-na,"Yoo Hai-jin, Yoon Kye-sang, Kim Hong-pa, Woo Hyeon, Kim Tae-hun"
565304,황진이,황진이,ko,2015-12-10,97,0,0,5.0,1,0.7166,"['로맨스', '드라마']",[],['KR'],2015.0,12.0,Sin Jeong-gyoon,"Jang Sung-won, Shin Yu-ju, Heo Dong-won, Jeong Neom-chyeo, Shim Ho-sung"
566397,남산의 부장들,남산의 부장들,ko,2020-01-22,113,0,0,7.0,133,1.567,"['드라마', '스릴러']","['Hive Media Corp', 'Gemstone Pictures', 'Showbox']",['KR'],2020.0,1.0,Woo Min-ho,"Lee Byung-hun, Lee Sung-min, Kwak Do-won, Lee Hee-jun, Kim So-jin"
566545,김군,김군,ko,2019-05-23,89,0,0,8.0,3,0.5231,['다큐멘터리'],"['Full Film', '1011 Film', 'Cinema 6411']",['KR'],2019.0,5.0,Kang Sang-woo,"Ahn Jee-hwan, Kim goon, Ji man won, Lee chang sung, Ju ok"
566936,삼촌,삼촌,ko,2019-11-28,99,0,0,5.7,9,1.245,"['드라마', '스릴러', '미스터리']",['Jin Film'],['KR'],2019.0,11.0,Kim Hyoung Jin,"Chung Ye-jin, Kang Shin-hyo, Kang Shin-chul, Ko Kyu-phil, No Ji-yoo"
567629,장사리: 잊혀진 영웅들,장사리: 잊혀진 영웅들,ko,2019-09-25,104,0,7883200,6.8,86,2.3093,"['드라마', '역사', '전쟁']","['Taewon Entertainment', 'Warner Bros. Korea', 'Film 295']",['KR'],2019.0,9.0,Kwak Kyung-taek,"Kim Myung-min, Minho, Kim Sung-cheol, Kim In-kwon, Kwak Si-yang"
567646,극한직업,극한직업,ko,2019-01-23,111,8120000,124652206,7.144,316,3.046,"['액션', '코미디', '범죄']","['CJ Entertainment', 'about Film', 'Haegrimm Pictures']",['KR'],2019.0,1.0,Lee Byeong-heon,"Ryu Seung-ryong, Lee Hanee, Jin Sun-kyu, Lee Dong-hwi, Gong Myoung"
567810,영시,영시,ko,2018-11-29,96,0,0,0.0,0,0.2559,[],[],[],2018.0,11.0,Choi Si-hyung,"Cho Hyun-chul, Choi Si-hyung, You E-den, Seo Eun-soo"
