movie_id,title,original_title,original_language,release_date,runtime,budget,revenue,vote_average,vote_count,popularity,genres,production_companies,production_countries,release_year,release_month,director,actors
302917,왓니껴,왓니껴,ko,2014-08-21,108,0,0,0.0,0,1.5875,['드라마'],[],['KR'],2014.0,8.0,Lee Dong-sam,"Shim Hye-jin, Jeon No-min, Lee Joo-sil, Cha Min-jee, Yoon Hee-won"
302945,정사,정사,ko,2014-10-30,91,0,0,6.0,22,10.5999,"['드라마', '로맨스']",[],['KR'],2014.0,10.0,Kim Jung-hwan,"Han Se-Ah, Jeon Ju-ho, Jung Wook, Park Eun-young, Ryu Sung-hyun"
302979,산타바바라,산타바바라,ko,2014-07-16,99,0,0,7.0,1,1.234,['로맨스'],['9ers Entertainment'],['KR'],2014.0,7.0,Cho Sung-kyu,"Lee Sang-yun, Yoon Jin-seo, Esom, Shin Dong-mi, Baek Won-gil"
303126,레드카펫,레드카펫,ko,2014-10-23,117,0,0,5.9,14,1.0896,"['로맨스', '코미디']","['Prain Global', 'Noori Pictures', 'Cinezoo', 'kth']",['KR'],2014.0,10.0,Park Beom-su,"Yoon Kye-sang, Go Joon-hee, Oh Jung-se, Jo Dal-hwan, Hwang Chan-seong"
303183,코알라,코알라,ko,2013-10-24,103,0,0,6.0,2,0.183,['드라마'],[],[],2013.0,10.0,Jason Kim,"Park Young-seo, Park Jin-joo, Song Yoo-ha, Park Yong-yeon"
303184,내 연애의 기억,내 연애의 기억,ko,2014-08-20,93,0,0,7.1,7,0.6272,"['코미디', '로맨스']",['IMTV'],[],2014.0,8.0,Lee Kwon,"Song Sae-byuk, Kang Ye-won, Park Gri-na, Kim Hyun-joon"
303186,별일 아니다,별일 아니다,ko,2014-02-13,124,0,0,7.0,1,0.1447,['드라마'],[],['KR'],2014.0,2.0,Kim Sang-seok,"Kim Sang-seok, Kim Tae-hee, Baek Jae-ho"
303187,숙희,숙희,ko,2014-07-10,93,0,0,6.0,2,0.4468,['로맨스'],[],['KR'],2014.0,7.0,Yang Ji-eun,"Chae Min-seo, Cho Han-cheul, Yang Eun-yong, Hong Seo-jun, Kyu Rin Kim"
303189,숫호구,숫호구,ko,2014-08-07,80,0,0,6.0,2,0.2849,['코미디'],['Atnine Film'],['KR'],2014.0,8.0,Back Seung-kee,"Back Seung-kee, Son I-yong, Cho Han-cheul, Kim Sun-ho, Sin Ye-joo"
303191,거짓말 2014,거짓말 2014,ko,2014-10-22,75,0,0,3.0,2,0.4494,"['드라마', '로맨스']",[],['KR'],2014.0,10.0,Lee Min-hwan,"Yoon Sul-hee, Hong Seok-yeon"
303193,먹이사슬,먹이사슬,ko,2014-09-17,100,0,0,4.5,2,1.921,"['드라마', '로맨스']",[],['KR'],2014.0,9.0,Han Dong-Ho,"Yoon Sul-hee, Kim Min-hyuk, Uhm Da-hye, Son Ji-wan, Ryu Il-song"
303654,파스카,파스카,ko,2015-07-09,97,0,0,0.0,0,0.8904,['드라마'],['MOVement'],['KR'],2015.0,7.0,Ahn Seon-kyoung,"Kim So-hee, Sung Ho-jun, Byun Joong-hee, Im Hyeong-tae, Shin Yeon-sook"
303784,사운드의 형이상학적 채집,사운드의 형이상학적 채집,xx,2008-01-01,28,0,0,0.0,0,0.1036,['음악'],['Korean Film Council'],['KR'],2008.0,1.0,Lee Hangjun,
303967,나의 독재자,나의 독재자,ko,2014-10-30,127,0,0,6.9,12,0.7816,['드라마'],"['Lotte Entertainment', 'Banzakbanzak Film Production']",['KR'],2014.0,10.0,Lee Hae-jun,"Sul Kyung-gu, Park Hae-il, Yoon Je-moon, Lee Byung-joon, Ryu Hye-young"
304320,못,못,ko,2014-11-20,109,0,0,5.0,2,0.753,['드라마'],"['Film New Wave', 'Mountain Pictures']",['KR'],2014.0,11.0,Seo Ho-bin,"Ho Hyo-hoon, Kang Bong-sung, Paul Lee, Byun Jun-suk, Kim Mi-kyeong"
305812,애증,애증,ko,2011-01-01,12,0,0,5.0,2,0.1297,"['가족', '드라마']",[],['KR'],2011.0,1.0,,"Kim Hye-na, Go Seo-hee, U Jun Jung, Yoon Jung-joo"
306598,"님아, 그 강을 건너지 마오","님아, 그 강을 건너지 마오",ko,2014-11-27,85,0,0,8.0,27,0.4148,"['다큐멘터리', '로맨스', '드라마']","['Argus Film', 'CGV Arthouse', 'Daemyung Culture Factory']",['KR'],2014.0,11.0,Jin Mo-young,"Cho Byeong-man, Kang Gye-yeol"
307217,우리는 형제입니다,우리는 형제입니다,ko,2014-10-23,102,0,0,6.5,9,1.7915,"['코미디', '드라마']","['Film It Suda', 'Showbox']",['KR'],2014.0,10.0,Jang Jin,"Cho Jin-woong, Kim Sung-kyun, Kim Young-ae, Yoon Jin-yi, Lee Hae-yeong"
308420,봄,봄,ko,2014-11-20,102,0,0,6.1,10,1.0718,"['드라마', '로맨스']","['Filament Pictures', 'kth', 'THE KLOCKWORX', 'Studio Hook']",['KR'],2014.0,11.0,Cho Keun-hyun,"Park Yong-woo, Kim Seo-hyung, Lee You-young, Joo Young-ho, Yoon Ye-hee"
308426,편지,편지,ko,2014-11-28,16,0,0,0.0,0,0.0,['다큐멘터리'],[],['KR'],2014.0,11.0,Lee Hyun-jung,
308429,The way back,The way back,ko,2014-09-20,11,0,0,7.575,20,0.1785,['애니메이션'],[],['KR'],2014.0,9.0,Sang-a Oh,"Su-bin Jeon, Jong-wook Choi"
308432,조문,조문,ko,2014-11-30,20,0,0,0.0,0,0.0143,[],[],['KR'],2014.0,11.0,,
308603,위층 여자,위층여자,ko,2014-10-29,95,0,0,4.75,2,0.5037,"['코미디', '드라마', '로맨스']",[],[],2014.0,10.0,Lee Chan-wook,"Seo Yu-ri, Park Won-bin, Kim Seung-ah, Khan Mohammad Asaduzzman, Kim Gyeong-ryong"
308610,힐링 메이트,힐링 메이트,ko,2014-11-01,108,0,0,5.2,3,1.2331,['로맨스'],[],[],2014.0,11.0,Sin Jong-Geol,"Eom Ji-hye, Jin Hye-Kyung, Lee Hong-sun, Lee Joo Yoon"
309054,사랑을 놓치다,사랑을 놓치다,ko,2006-01-26,118,0,0,6.2,9,1.3977,"['드라마', '로맨스']","['CJ Entertainment', 'Cinema Service']",['KR'],2006.0,1.0,Choo Chang-min,"Sul Kyung-gu, Song Yun-ah, Lee Ki-woo, Lee Hwi-hyang, Jang Hang-seon"
309834,Pig Iron,Pig Iron,en,2010-05-01,30,0,0,7.2,5,0.0646,[],['Jeonju International Film Festival'],"['KR', 'US']",2010.0,5.0,James Benning,
311058,신성일의 행방불명,신성일의 행방불명,ko,2006-02-16,103,0,0,5.0,4,0.0286,['드라마'],[],['KR'],2006.0,2.0,Shin Jae-in,
311224,아빠를 빌려드립니다,아빠를 빌려드립니다,ko,2014-11-20,112,0,0,7.2,4,0.9557,"['코미디', '드라마', '가족']","['Plus M Entertainment', 'Redrover']",['KR'],2014.0,11.0,Kim Deok-su,"Kim Sang-kyung, Moon Jeong-hee, Nam Bo-ra, Bang Min-ah, Chae Jung-an"
311630,덕수리 5형제,덕수리 5형제,ko,2014-12-04,102,0,0,7.7,3,0.4432,"['스릴러', '코미디']",['Lotte Entertainment'],['KR'],2014.0,12.0,Jeon Hyung-jun,"Yoon Sang-hyun, Hwang Chan-seong, Lee Kwang-soo, Song Sae-byuk, Lee Ji-yeon"
311953,마지막 밥상,마지막 밥상,ko,2008-03-19,93,0,0,6.0,2,0.6821,['드라마'],['INDIE SPACE'],['KR'],2008.0,3.0,Roh Gyeong-tae,"Baek Hyun-joo, Hong Seok-yeon, Bok-soon Hwang, Kim Do-yeon, Oh Heung-ki"
313108,국제시장,국제시장,ko,2014-12-17,126,0,105365782,7.5,123,2.0804,['드라마'],"['CJ Entertainment', 'JK Film']",['KR'],2014.0,12.0,JK Youn,"Hwang Jung-min, Yunjin Kim, Oh Dal-su, Jung Jin-young, Jang Young-nam"
313628,오늘의 연애,오늘의 연애,ko,2015-01-14,121,0,0,6.7,43,0.9809,"['코미디', '로맨스']",['CJ Entertainment'],['KR'],2015.0,1.0,Park Jin-pyo,"Lee Seung-gi, Moon Chae-won, Lee Seo-jin, Jung Joon-young, Go Yoon"
313782,다우더,다우더,ko,2014-11-06,84,0,0,6.833,3,0.671,['드라마'],[],[],2014.0,11.0,Koo Hye-sun,"Koo Hye-sun, Shim Hye-jin, Jung Ji-so, Lee Hae-Woo, Son Ji-na"
313980,캠퍼스 S 커플,캠퍼스 S 커플,ko,2014-05-15,108,0,0,0.0,0,1.5073,['로맨스'],[],['KR'],2014.0,5.0,Song Chang-yong,"Moon Bo-ryoung, Seo Hyo-myeong, Phillip Choi, Hwang Bo-Mi, Park Ran"
314327,상의원,상의원,ko,2014-12-24,127,0,0,7.217,30,1.1314,"['드라마', '역사']","['Bidangil Pictures', 'WAW Pictures', 'Michigan Venture Capital', 'Union Investment Partners', 'Showbox', 'Finecut']",['KR'],2014.0,12.0,Lee Won-suk,"Han Suk-kyu, Go Soo, Park Shin-hye, Yoo Yeon-seok, Lee Yu-bi"
314491,디렉터스 컷,디렉터스 컷,ko,2014-05-04,96,0,0,5.0,1,0.0382,[],[],[],2014.0,5.0,Joonbum Park,"Park Jung-pyo, Song Hee Han, Kim Ha-young, Jang Gi-hoon, Park In-ji"
314493,누구에게나 찬란한,누구에게나 찬란한,ko,2014-05-09,100,0,0,0.0,0,0.1507,['다큐멘터리'],['CGV Arthouse'],['KR'],2014.0,5.0,Lim Yu-cheol,Kim Nam-gil
314497,레디액션 청춘,레디액션 청춘,ko,2014-11-13,125,0,0,7.2,8,0.8553,"['드라마', '스릴러']",['Invent Stone'],['KR'],2014.0,11.0,Ju Seong-su,"Donghae, Park So-dam, Woorin, Seo Eun-ah, Nam Seong-joon"
314499,귀접,귀접,ko,2014-05-29,80,0,0,6.2,9,0.8071,['드라마'],[],[],2014.0,5.0,Lee Hyeon-cheol,"Park Soo-in, Lee Eon-jeong, Choi Ri-ho, Jaeseung Kim, Yoon Chae-yeong"
314508,망대,망대,ko,2014-05-07,63,0,0,0.0,0,0.0306,['다큐멘터리'],[],['KR'],2014.0,5.0,Moon Seung-wook,
314569,살인재능,살인재능,ko,2015-07-30,103,0,0,5.9,8,1.3255,"['범죄', '드라마', '스릴러']",['Jaihong Juhn Film'],['KR'],2015.0,7.0,Juhn Jai-hong,"Kim Bum-joon, Bae Jung-hwa, Jun Bum-soo, Kyung Gyu-won, Park Ji-a"
314571,들꽃,들꽃,ko,2014-06-15,114,0,0,5.0,1,0.5676,['드라마'],"['Indieplug', 'Moviengine']",['KR'],2014.0,6.0,Park Suk-young,"Jeong Ha-dam, Cho Soo-hyang, Kwon Eun-soo, Paul Lee, Kang Bong-sung"
314586,거짓말,거짓말,ko,2015-10-29,95,0,0,5.5,4,0.6895,['드라마'],"['Daemyung Culture Factory', 'Little Big Pictures']",['KR'],2015.0,10.0,Kim Dong-myung,"Kim Kkob-bi, Chun Sin-hwan, Kim Young-sun, Kwon Nam-hee, Won Pung-yeon"
314636,메이드 인 차이나,메이드 인 차이나,ko,2014-10-25,100,0,0,5.0,6,0.5354,['드라마'],['Kim Ki Duk Film'],['KR'],2014.0,10.0,Kim Dong-hoo,"Han Chae-a, Im Hwa-young, Park Ki-woong, Woo Yong-hee, Jung Tae-sung"
314639,현기증,현기증,ko,2014-11-06,94,0,0,6.5,6,1.4349,['드라마'],['Plus M Entertainment'],['KR'],2014.0,11.0,Lee Don-ku,"Kim Young-ae, Song Il-gook, Kim So-eun, Do Ji-won, Lee Min-ji"
314821,삼총사: 용감한 친구들,삼총사: 용감한 친구들,ko,2013-01-01,0,0,0,10.0,1,0.1637,[],[],[],2013.0,1.0,Orlando Corradi,
314987,명기,명기,ko,2014-12-30,94,0,0,5.5,4,0.894,['드라마'],[],['KR'],2014.0,12.0,Kang Hyeon,"Kim Min-yeong, Lee Sang-hoon, Kim Jung-pal, Kang Yong-Kyu, Kim Gi-yeon"
315202,스카우트,스카우트,ko,2007-11-14,94,3600000,0,7.1,8,0.6068,['코미디'],"['CJ Entertainment', 'Vantage Holdings']",['KR'],2007.0,11.0,Kim Hyun-seok,"Im Chang-jung, Uhm Ji-won, Park Cheol-min, Lee Dae-yeon, Baek Il-seob"
315439,사도,사도,ko,2015-09-16,125,0,42165755,7.091,93,1.1515,"['드라마', '역사']",['Tiger Pictures'],['KR'],2015.0,9.0,Lee Joon-ik,"Yoo Ah-in, Song Kang-ho, Lee Hyo-je, So Ji-sub, Moon Geun-young"
315719,민우씨 오는 날,민우씨 오는 날,ko,2014-03-27,28,0,0,7.2,6,0.5786,"['로맨스', '드라마']","['Big Picture', 'Mirovision']",['KR'],2014.0,3.0,Kang Je-kyu,"Moon Chae-won, Go Soo, Kim Soo-ro, Son Sook, Yoo Ho-jeong"
316554,배드 버그,배드 버그,ko,2013-07-20,27,0,0,0.0,0,0.0143,[],[],[],2013.0,7.0,Kyung-Heub Song,
317991,블랙스톤,블랙스톤,ko,2016-03-28,92,0,0,5.3,11,2.0195,['드라마'],"['Neon Productions', 'Teddy Roh Productions']","['KR', 'FR']",2016.0,3.0,Roh Gyeong-tae,"Won Tae-hee, Son Suk-ku, Jung Yong-sik, Baek Hyun-joo"
318541,워킹걸,워킹걸,ko,2015-01-07,112,28600000,998000,5.7,17,2.2994,"['코미디', '로맨스']","['Soo Film', 'Hong Film', 'Plus M Entertainment', 'kth']",['KR'],2015.0,1.0,Jung Bum-shik,"Cho Yeo-jeong, Clara Lee, Kim Tae-woo, Kim Bo-yeon, Ra Mi-ran"
318752,울언니,울언니,ko,2014-12-04,97,0,0,5.5,2,0.3269,"['스릴러', '드라마']",[],['KR'],2014.0,12.0,Lee Je-rak,"Oh Kwang-rok, Yang Ha-Eun, Ji Sung-won, Jo Sang-gu, Kwon Byung-gil"
319130,더 테너 리리코 스핀토,더 테너 리리코 스핀토,ko,2014-10-11,121,500,0,6.0,1,0.5994,"['음악', '드라마']","['Voice Factory', 'Basara Pictures', 'Social Capital', 'Viktorija Film', 'More In Group']","['JP', 'RS', 'KR', 'US']",2014.0,10.0,Kim Sang-man,"Yoo Ji-tae, Yūsuke Iseya, Cha Ye-ryun, Kie Kitano, Nataša Tapušković"
319975,드롭박스,드롭박스,ko,2015-03-03,79,0,0,7.545,11,0.305,['다큐멘터리'],['Pine Creek Entertainment'],['KR'],2015.0,3.0,Brian Ivie,
320150,빅매치,빅매치,ko,2014-11-26,112,500,0,7.024,41,1.0764,"['코미디', '액션', '스릴러']","['BK Pictures', 'Next Entertainment World', 'Opus Pictures', 'Daemyung Culture Factory', 'kth', 'Union Investment Partners', 'United Pictures']",['KR'],2014.0,11.0,Choi Ho,"Lee Jung-jae, Shin Ha-kyun, Kwon BoA, Lee Sung-min, Ra Mi-ran"
321172,천 번을 불러도,천 번을 불러도,ko,2014-10-16,97,0,0,6.5,5,1.2368,['드라마'],[],['KR'],2014.0,10.0,Sin Seong-seop,"Kimchoi Yong-joon, Lee Cheong-mi, Jeong Min-sung, Park Jeong-sik, Im Jae-geun"
321191,허삼관,허삼관,ko,2015-01-14,124,0,0,7.1,34,1.4095,"['로맨스', '드라마', '역사']","['Next Entertainment World', 'Fantagio', 'Dhutayeon']",['KR'],2015.0,1.0,Ha Jung-woo,"Ha Jung-woo, Ha Ji-won, Nam Da-reum, No Kang-min, Jeon Hye-jin"
321371,마녀,마녀,ko,2014-09-11,93,0,0,6.7,3,1.181,['공포'],['CGV Arthouse'],['KR'],2014.0,9.0,Yoo Young-seon,"Park Joo-hee, Na Soo-yoon, Lee Ru-ahn, Sin Ye-jin, Lee Ik-jun"
321449,시선 너머,시선 너머,ko,2011-04-28,144,0,0,6.0,1,1.1026,['드라마'],"['Indiestory', 'National Human Rights Commission of Korea']",['KR'],2011.0,4.0,Kim Dae-seung,"Park Jung-wook, Seo Ok-byeol, Park Mi-hyeon, Choi Moo-seong, Danzan Davaanyam"
322498,그림자,그림자,ko,2007-10-11,87,0,0,5.3,3,0.7099,['공포'],[],['KR'],2007.0,10.0,Kim Min-Sook,"Lee Mu-saeng, Jeon Bo-yeong, Myeong Seung-hun, Lee Hee-jun, Jeong In-ji"
322499,4요일,4요일,ko,2008-12-11,80,0,0,1.0,1,0.8232,['공포'],[],['KR'],2008.0,12.0,Seo Min-yeong,"Im Ye-won, Lee Jae-yong, Jung Woon-taek, Lee Won-jae"
322527,마녀의 관,마녀의 관,ko,2008-10-01,120,0,0,0.0,0,0.8873,"['판타지', '공포']",['BlueStorm'],['KR'],2008.0,10.0,Park Jin-seong,"Jung Seung-kil, Hwang Taek-ha, Kim Du-yong, Lee Se-rang"
322528,미스터 좀비,미스터 좀비,ko,2010-08-26,105,0,0,5.0,2,0.7183,"['코미디', '공포']",[],['KR'],2010.0,8.0,Lee Soo-sung,"Won Pung-yeon, Bae Noo-ri, Lee Yong-nyeo, Roh Hyung-wuk, Lee Sang-hun"
322529,킬링타임,킬링타임,ko,2012-03-15,88,0,0,6.0,1,2.0656,['공포'],[],['KR'],2012.0,3.0,Park Seong-soo,"Lee Ji-hye, Kim Jin-geun, Kim Byung-choon, Jung Ae-yeun"
322530,환상극장,환상극장,ko,2011-03-17,76,0,0,5.5,2,0.382,['공포'],['Indiestory'],['KR'],2011.0,3.0,Kim Tae-gon,"Lee Hyun-woo, Choo Ja-hyun, Kim Deanna, Kwak Min-seok, Jang Jun-nyeong"
322534,수목장,수목장,ko,2012-11-15,100,0,0,6.0,1,1.4264,['공포'],[],['KR'],2012.0,11.0,Park Kwang-chun,"Lee Young-ah, On Ju-wan, Park Soo-jin, Yeon Je-wook, Go Won-hee"
322535,부귀영화,부귀영화,ko,2012-10-25,85,0,0,5.0,1,0.0898,"['스릴러', '공포']",[],['KR'],2012.0,10.0,Jin-mi In,"Lee Yul-ri, Park Hye-rin, Jeon Hui-gyeong"
322537,아름다운 이별은 없다,아름다운 이별은 없다,ko,2013-08-22,90,0,0,5.0,1,0.1303,"['스릴러', '공포']",[],['KR'],2013.0,8.0,Lee Sang-hwa,"Ko Soo-hyun, Hwang Jung-a"
322543,좀비스쿨,좀비스쿨,ko,2014-09-25,87,0,0,6.8,3,1.5269,['공포'],"['Dolby', 'Dolby illustration']",['KR'],2014.0,9.0,Kim suk-jung,"Baek Seo-bin, Cha Min-jee, Kim Gyeong-ryong, Kim Seung-hwan, Park Jae-hoon"
322587,화끈한 써비스: 어느 잔인한 미용사의,화끈한 써비스: 어느 잔인한 미용사의,ko,2015-01-29,72,0,0,4.0,1,0.2474,"['스릴러', '공포', '드라마', '로맨스']",[],['KR'],2015.0,1.0,Nam Ki-woong,"Lee Eon-jeong, Lee Won-jong, Jo Kyeong-hoon, Jo Ha-seok"
322671,콘돌은 날아간다,콘돌은 날아간다,ko,2013-05-30,102,0,0,5.5,5,1.4347,['드라마'],"['Mountain Pictures', 'Dongnyuk Film']",['KR'],2013.0,5.0,Jeon Soo-il,"Cho Jae-hyun, Bae Jung-hwa, Yoo Yeon-mi"
322684,개와 늑대 사이의 시간,개와 늑대 사이의 시간,ko,2007-06-21,110,0,0,5.3,8,0.73,['드라마'],['Dongnyuk Film'],['KR'],2007.0,6.0,Jeon Soo-il,"An Kil-kang, Kim Sun-jae, Kim Gwi-seon"
322692,영도다리,영도다리,ko,2010-07-01,83,0,0,5.0,1,1.2881,['드라마'],"['Mountain Pictures', 'Dongnyuk Film']",['KR'],2010.0,7.0,Jeon Soo-il,"Park Ha-seon, Kim Jung-tae"
323928,사랑은 단백질,사랑은 단백질,ko,2008-06-24,24,0,0,7.0,2,1.4841,"['애니메이션', '코미디', '드라마']",[],['KR'],2008.0,6.0,Yeon Sang-ho,"Yang Ik-june, Oh Jung-se, Park Jin-su, Lee Don-yong, Choi Geun-chang"
324357,생각보다 맑은,생각보다 맑은,ko,2015-01-22,77,0,0,0.0,0,0.7101,"['애니메이션', '드라마']",['Studio Alo'],['KR'],2015.0,1.0,Han Ji-won,"Yang Jeong-hwa, Um Sang-hyun, Lee Ho-min"
324671,어우동: 주인없는 꽃,어우동: 주인없는 꽃,ko,2015-01-29,100,0,0,5.583,6,1.9238,"['드라마', '역사', '스릴러']",[],['KR'],2015.0,1.0,Lee Soo-sung,"Song Eun-Chae, Yeo Wook-hwan, Yoo Jang-young, Baek Do-bin, Kim Ki-doo"
324713,쇼킹 패밀리,쇼킹 패밀리,ko,2006-05-08,111,0,0,0.0,0,0.1421,['다큐멘터리'],['Redsnowman'],['KR'],2006.0,5.0,Kyung-soon,
326614,다섯은 너무 많아,다섯은 너무 많아,ko,2005-11-25,80,0,0,0.0,0,0.7317,[],[],[],2005.0,11.0,Ahn Seul-Gi,"Choi Si-hyung, Song Ye-Ju, Jo Byung-Gi, Kim Min-su"
326854,내 심장을 쏴라,내 심장을 쏴라,ko,2015-01-28,102,0,0,7.825,20,1.2996,['드라마'],"['Jupiter Film', 'Little Big Pictures', 'kth', 'ISU C&E', '9ers Entertainment', 'Sidus']",['KR'],2015.0,1.0,Je-yong Mun,"Lee Min-ki, Yeo Jin-goo, Yu Oh-seong, Kim Jung-tae, Shin Gu"
328716,조선명탐정: 사라진 놉의 딸,조선명탐정: 사라진 놉의 딸,ko,2015-02-11,125,0,27387870,6.6,23,1.1353,"['액션', '미스터리', '코미디']","['Generation Blue Films', 'Showbox']",['KR'],2015.0,2.0,Kim Sok-yun,"Kim Myung-min, Oh Dal-su, Lee Yeon-hee, Jung Won-joong, Hwang Chae-won"
329253,장수상회,장수상회,ko,2015-04-09,112,0,0,7.8,22,1.1013,"['코미디', '로맨스']","['CJ Entertainment', 'Big Picture']",['KR'],2015.0,4.0,Kang Je-kyu,"Park Keun-hyong, Youn Yuh-jung, Cho Jin-woong, Han Ji-min, Hwang Woo-seul-hye"
329321,살인캠프,살인캠프,ko,2015-03-05,98,0,0,4.3,3,1.0973,['스릴러'],[],['KR'],2015.0,3.0,Lee Sang-Bin,"Baek Do-bin, Jung Si-a, Kwak Do-won, Kim Seung-o, Um Tae-goo"
330829,도쿄택시,도쿄택시,ko,2009-10-09,75,0,0,5.5,1,1.3247,"['드라마', '코미디']",['Film Line'],"['JP', 'KR']",2009.0,10.0,Kim Tai-sik,"Masashi Yamada, Hajime Yamazaki, Yu Ha-Na, Lee dong-ho, Hiromitsu Takeda"
330848,상어,상어,ko,2007-10-07,107,0,0,5.0,4,0.097,['드라마'],[],['KR'],2007.0,10.0,Kim Dong-hyun,"Kim Mi-Ya, Hong Seung-il, Ku Sung-hwan, Ju Jin-mo"
331251,스물,스물,ko,2015-03-25,115,0,0,7.213,108,1.2225,"['코미디', '드라마']","['Next Entertainment World', 'iHQ']",['KR'],2015.0,3.0,Lee Byeong-heon,"Kim Woo-bin, Lee Jun-ho, Kang Ha-neul, Jung So-min, Lee Yu-bi"
331422,달에 부는 바람,달에 부는 바람,ko,2016-05-26,98,0,0,0.0,0,0.3351,[],"['Minch&Films', 'MOVement']",['KR'],2016.0,5.0,Yi Seung-jun,
331423,잡식가족의 딜레마,잡식가족의 딜레마,ko,2015-05-07,105,0,0,0.0,0,0.2793,['다큐멘터리'],"['Cinema Dal', 'Studio DUMA']",['KR'],2015.0,5.0,Hwang Yoon,Hwang Yoon
331803,붕괴,붕괴,ko,2014-10-09,78,0,0,0.0,0,0.0637,['다큐멘터리'],[],[],2014.0,10.0,Mun Jeong-hyun,
332260,적의 사과,적의 사과,ko,2007-03-19,22,0,0,6.0,3,0.2045,"['드라마', '코미디']",[],['KR'],2007.0,3.0,Lee Su-jin,"Yoo Seung-mok, Lee Jong-pil, Kim Ki-cheon"
332415,친절한 가정부,친절한 가정부,ko,2015-02-26,75,0,0,3.75,4,0.8008,['코미디'],[],['KR'],2015.0,2.0,No Zin-soo,"Yeong-geon, Aino Kishi, Yeon Song-ha, Park In-Soo"
332834,태양을 쏴라,태양을 쏴라,ko,2015-03-19,87,0,0,5.0,3,0.4997,"['로맨스', '액션']","['JNC Media Group', 'Film Line']",['KR'],2015.0,3.0,Kim Tai-sik,"Kang Ji-hwan, Yoon Jin-seo, Davis Choh, Ahn Suk-hwan"
332941,청춘 그루브,청춘 그루브,ko,2012-03-15,94,0,0,0.0,0,0.3212,['드라마'],"['Dhutayeon', 'Dasepo Club']",['KR'],2012.0,3.0,Byun Sung-hyun,"Bong Tae-gyu, Lee Young-hoon, Kwak Ji-min, Byun Sung-hyun"
333167,순수의 시대,순수의 시대,ko,2015-03-05,113,0,3191168,7.0,50,6.8509,"['로맨스', '드라마', '역사']","['Fineworks', 'CJ Entertainment']",['KR'],2015.0,3.0,Ahn Sang-hoon,"Jang Hyuk, Kang Hanna, Shin Ha-kyun, Kang Ha-neul, Son Byung-ho"
333451,개: Dog Eat Dog,개: Dog Eat Dog,ko,2015-03-05,105,0,0,4.5,2,0.2077,"['스릴러', '드라마']",[],['KR'],2015.0,3.0,Hwang Wook,"Kim Sun-bin, Kwak Min-ho, Jung Joon-gyo, Lee Ha-min, Gong Min-jeung"
333500,물속의 도시,물속의 도시,ko,2015-02-12,80,0,0,0.0,0,0.1976,[],[],[],2015.0,2.0,Kim Eung-soo,
333713,헬머니,헬머니,ko,2015-03-05,108,0,0,7.8,12,1.2532,['코미디'],"['Next Entertainment World', 'The Contents On', 'The Pictures with a View']",['KR'],2015.0,3.0,Shin Han-sol,"Kim Soo-mi, Jeong Man-sik, Kim Jung-tae, Lee Tae-ran, Jung Ae-yeun"
334306,천안함 프로젝트,천안함 프로젝트,ko,2013-09-05,75,0,0,7.0,1,0.1804,['다큐멘터리'],['Aura Pictures'],['KR'],2013.0,9.0,Baek Seung-woo,"Kang Shin-il, Lee Jong-in"
334309,기화,기화,ko,2015-02-26,127,0,0,6.0,2,0.1662,"['가족', '드라마']",['AVANT-GARDE FILM'],['KR'],2015.0,2.0,Moon Jeong-yun,"Kim Hyun-joon, Son Min-ji, Gong Jae-min"
334311,MB의 추억,MB의 추억,ko,2012-10-18,65,0,0,7.0,2,0.8057,"['코미디', '다큐멘터리']","['b2e', 'Studio Nurimbo']",['KR'],2012.0,10.0,Kim Jae-hwan,"Lee Myung-bak, Choi Soo-jong, Kim Je-dong, Yu In-chon, Ahn Suk-hwan"
334313,맥코리아,맥코리아,ko,2012-10-18,78,0,0,0.0,0,0.1109,"['코미디', '다큐멘터리']",[],['KR'],2012.0,10.0,Kim Hyoung-ryol,"Lee Myung-bak, Gong Ji-young"
335117,맛있는 택배,맛있는 택배,ko,2015-04-02,84,0,0,4.4,5,2.8461,['로맨스'],['Road House'],['KR'],2015.0,4.0,Gi Dae-ho,"Song Gi-joon, Son Ga-ram, Jeon Eun-jin, Ban Hee, Jeon Ye-eun"
335157,비치하트애솔,비치하트애솔,ko,2015-01-29,100,0,0,4.333,3,1.0153,['로맨스'],['Golden Tide Pictures'],['KR'],2015.0,1.0,Inan,"Kwon Hyun-sang, Lee Ga-heun, Han Sa-myeong, Park Myung-shin, Kim Dong-wan"
335502,쿼바디스,쿼바디스,ko,2014-12-10,105,0,0,7.0,1,0.1847,['다큐멘터리'],['DANEW FILM'],['KR'],2014.0,12.0,Kim Jae-hwan,"Nam Myung-ryeol, Ahn Suk-hwan"
335640,살인의뢰,살인의뢰,ko,2015-03-12,102,0,0,5.8,36,0.9319,"['범죄', '드라마', '스릴러']",['9ers Entertainment'],['KR'],2015.0,3.0,Son Yong-ho,"Kim Sang-kyung, Kim Sung-kyun, Park Sung-woong, Yoon Seung-ah, Kim Eui-sung"
335761,비밀의 화방,비밀의 화방,ko,2013-12-11,68,0,0,0.0,0,0.2517,['로맨스'],[],[],2013.0,12.0,Jin Dal-rae,"Joo Hye-ri, Song Jeong-eun, Baek Ma-ri"
336053,무뢰한,무뢰한,ko,2015-05-15,118,0,0,6.444,36,1.6394,"['드라마', '범죄']","['CGV Arthouse', 'Sanai Pictures']",['KR'],2015.0,5.0,Oh Seung-uk,"Jeon Do-yeon, Kim Nam-gil, Park Sung-woong, Kwak Do-won, Kim Min-jae"
336054,마돈나,마돈나,ko,2015-05-20,120,0,0,5.9,9,0.5104,['드라마'],['JUNE Film'],['KR'],2015.0,5.0,Shin Su-won,"Seo Young-hee, Kwon So-hyun, Kim Young-min, Yoo Soon-chul, Byun Yo-han"
336055,오피스,오피스,ko,2015-09-03,111,0,0,6.4,69,0.7847,"['스릴러', '미스터리']","['Little Big Pictures', 'kth', 'Film Blossom']",['KR'],2015.0,9.0,Hong Won-chan,"Ko A-sung, Park Sung-woong, Bae Sung-woo, Kim Eui-sung, Ryu Hyun-kyung"
336744,차이나타운,차이나타운,ko,2015-04-29,110,0,0,7.0,102,1.5669,"['드라마', '스릴러']","['Barunson', 'CGV Arthouse']",['KR'],2015.0,4.0,Han Jun-hee,"Kim Hye-soo, Kim Go-eun, Um Tae-goo, Park Bo-gum, Go Kyung-pyo"
337132,검은손,검은손,ko,2015-04-16,96,0,0,5.4,8,1.1326,['공포'],['Golden Tide Pictures'],['KR'],2015.0,4.0,Park Jae-sik,"Han Go-eun, Kim Sung-su, Bae Geu-rin, Shin Jung-sun, Park Seo-yeon"
337301,꽃보다 처녀귀신,꽃보다 처녀귀신,ko,2015-01-15,103,0,0,4.5,2,0.8595,['코미디'],[],[],2015.0,1.0,Park Je-hyun,"Ahn Jae-Min, Maeng Seung-ji, Kim Sung-eun, Jang Hyuk-jin, Kim Mi-rim"
337943,뽀로로 극장판 눈요정 마을 대모험,뽀로로 극장판 눈요정 마을 대모험,ko,2014-07-01,35,0,0,7.5,3,0.6584,"['애니메이션', '가족', '모험', '판타지']",['OCON Studios'],['KR'],2014.0,7.0,Kim Hyun-ho,"Lee Sun, Ham Su-jung, Hong So-young, Lee Mi-ja, Chung Mi-sook"
338729,뷰티 인사이드,뷰티 인사이드,ko,2015-08-20,127,0,14301869,7.7,270,1.6871,"['판타지', '로맨스']","['Yong Film', 'Next Entertainment World']",['KR'],2015.0,8.0,Baik,"Han Hyo-joo, Kim Dae-myung, Do Ji-han, Bae Sung-woo, Park Shin-hye"
338803,간신,간신,ko,2015-05-21,131,0,6906250,6.0,79,4.314,"['드라마', '역사', '범죄']","['Lotte Entertainment', 'Soo Film']",['KR'],2015.0,5.0,Min Kyu-dong,"Ju Ji-hoon, Kim Kang-woo, Lim Ji-yeon, Lee You-young, Cheon Ho-jin"
339295,약장수,약장수,ko,2015-04-23,104,0,0,6.0,3,0.5988,['드라마'],"['26 Company', '9ers Entertainment', 'Daemyung Culture Factory', 'The Contents On']",['KR'],2015.0,4.0,Jo Chi-eon,"Kim In-kwon, Park Cheol-min, Lee Joo-sil, Choi Jae-hwan, Kim Si-young"
339534,스피드,스피드,ko,2015-10-22,108,0,0,6.0,1,0.9766,['드라마'],"['Moviengine', 'Dreamfact Entertainment']",['KR'],2015.0,10.0,Lee Sang-woo,"Seo Jun-young, Baek Sung-hyun, Choi Tae-hwan, Byun Jun-suk, Lim Hyung-jun"
340067,나의 절친 악당들,나의 절친 악당들,ko,2015-06-25,109,0,0,5.2,11,1.9275,"['액션', '모험', '코미디', '스릴러']","['20th Century Fox Korea', 'M-Line Distribution', 'Fox International Productions Korea', 'Ivanhoe Pictures']","['KR', 'US']",2015.0,6.0,Im Sang-soo,"Ryoo Seung-bum, Go Joon-hee, Samuel Okyere, Yang Ik-june, Ryu Hyun-kyung"
340114,구럼비-바람이 분다,구럼비-바람이 분다,ko,2013-10-06,100,0,0,0.0,0,0.1509,['다큐멘터리'],['Cinema Dal'],['KR'],2013.0,10.0,Sung Bong Cho,
340579,삼례,삼례,ko,2016-06-23,93,0,0,5.0,1,1.0625,"['드라마', '판타지']","['Indieplug', 'Jeonju International Film Festival']",['KR'],2016.0,6.0,Lee Hyun-jung,"Kim Bo-ra, Lee Seon-ho, Lee Yong-nyeo, Kwon Jai-hyun, Yoo So-hyeon"
340746,악의 연대기,악의 연대기,ko,2015-05-14,102,0,0,7.3,68,1.4747,"['스릴러', '범죄']","['CJ Entertainment', 'BA Entertainment']",['KR'],2015.0,5.0,Baek Woon-hak,"Son Hyun-joo, Don Lee, Park Seo-jun, Choi Daniel, Lee Sang-won"
340819,연애의 맛,연애의 맛,ko,2015-05-07,101,0,1520000,6.583,18,3.276,"['드라마', '코미디', '로맨스']","['WAW Pictures', 'Showbox', 'M-Line Distribution']",['KR'],2015.0,5.0,Aaron Kim,"Kang Ye-won, Oh Ji-ho, Ha Joo-hee, Hong Yi-joo, Kim Joong-hee"
340852,두 번째 엄마,두 번째 엄마,ko,2014-12-31,74,0,0,4.5,2,1.1004,"['로맨스', '드라마']",[],[],2014.0,12.0,Lee Min-hwan,"Yoon Sul-hee, Lee Yo-seong, Kim Min-seong-II, Kim Woon, Kim Si-eon"
