movie_id,title,original_title,original_language,release_date,runtime,budget,revenue,vote_average,vote_count,popularity,genres,production_companies,production_countries,release_year,release_month,director,actors
875153,카시오페아,카시오페아,ko,2022-01-06,101,0,0,7.0,17,1.1258,['드라마'],"['Luz y Sonidos', 'Triple Pictures', 'Wysiwyg Studios']",['KR'],2022.0,1.0,Shin Yeon-shick,"Ahn Sung-ki, Seo Hyun-jin, Joo Ye-rim, Kim Da-huin, Hong Sung-chun"
876127,도그데이즈,도그데이즈,ko,2024-02-07,119,0,0,7.6,14,1.3486,"['드라마', '코미디']","['JK Film', 'CJ ENM', 'Zion Ent Inc.']",['KR'],2024.0,2.0,Kim Deok-min,"Youn Yuh-jung, Yoo Hai-jin, Yunjin Kim, Chung Sung-hwa, Kim Seo-hyung"
876834,평화로운 신도시의 초대,평화로운 신도시의 초대,ko,2005-01-01,52,0,0,0.0,0,0.0639,['다큐멘터리'],[],[],2005.0,1.0,Kelvin Kyung Kun Park,
877260,뒤틀린 집,뒤틀린 집,ko,2022-07-13,90,0,462593,4.5,9,1.467,"['공포', '미스터리']",['TAKEONE STUDIO'],['KR'],2022.0,7.0,Kang Dong-hun,"Seo Young-hee, Kim Min-jae, Do Yeong-seo, Cho Soo-hyang, Park Hyuk-kwon"
877263,요정,요정,ko,2022-12-01,80,0,0,5.7,3,0.5889,['드라마'],['Korea National University of Arts'],['KR'],2022.0,12.0,Shin Tack-su,"Ryu Hyun-kyung, Kim Ju-hun, Kim Shin-bi, Kim Keum-soon, Gong Sang-a"
877265,우수,우수,ko,2022-11-24,79,0,0,5.5,2,0.185,['드라마'],"['Lu Film', 'Indiestory']",['KR'],2022.0,11.0,Oh Se-hyeon,"Yoon Je-moon, Kim Tae-hun, Moon Jung-woong"
877295,둠둠,둠둠,ko,2022-09-15,112,0,0,5.0,2,1.0141,['드라마'],"['Jinjin Pictures', 'East Gate Company']",['KR'],2022.0,9.0,Jung Won-hee,"Kim Yong-ji, Yun Yoo-sun, Park Jong-hwan, An Min-young, Kim Seung-bee"
877315,컨버세이션,컨버세이션,ko,2023-02-23,120,0,0,5.0,1,0.3656,['드라마'],[],['KR'],2023.0,2.0,Kim Duk-joong,"Cho Eun-ji, Park Jong-hwan, Kwak Min-kyu, Kim Soy, Kwak Jin-mu"
877401,초록밤,초록밤,ko,2022-07-28,89,0,0,6.0,2,0.2095,['드라마'],['Indiestory'],['KR'],2022.0,7.0,Yoon Seo-jin,"Kim Min-kyung, Kang Gil-woo, Kim Guk-hee, Oh Min-ae, Won Mi-won"
877409,낮에는 덥고 밤에는 춥고,낮에는 덥고 밤에는 춥고,ko,2022-10-27,90,0,0,6.5,2,0.1356,['드라마'],[],['KR'],2022.0,10.0,Park Song-yeol,"Won Hyang-ra, Park Song-yeol"
877411,절해고도,절해고도,ko,2023-09-27,116,0,0,5.0,1,1.3974,['드라마'],[],['KR'],2023.0,9.0,Kim Mi-young,"Park Jong-hwan, Lee Yeon, Kang Kyung-hun, Park Hyun-suk, Jang Jun-whee"
877424,모퉁이,모퉁이,ko,2022-08-11,73,0,0,0.0,0,0.8374,['드라마'],['gram FILMS'],['KR'],2022.0,8.0,Shin Sun,"Lee Taek-geun, Ha Seong-guk, Park Bong-jun, Baek Soo-hee, Hwang Mi-young"
877426,벗어날 탈 脫,벗어날 탈 脫,ko,2024-02-21,72,0,0,5.0,2,0.4313,['미스터리'],[],['KR'],2024.0,2.0,Seo Bo-hyung,"Lim Ho-jun, Oui Ji-won, Kwon Da-ham, Jang Jun-whee"
877427,소피의 세계,소피의 세계,ko,2022-03-03,113,0,0,5.7,3,0.7213,['드라마'],[],['KR'],2022.0,3.0,Lee Jea-han,"Kim Sae-byuk, Kwak Min-kyu, Ana Ruggiero, Kim Woo-kyum, Moon Hye-in"
877429,"그 겨울, 나는","그 겨울, 나는",ko,2022-11-30,100,0,0,6.0,2,1.4092,"['드라마', '로맨스']",['Korean Academy of Film Arts'],['KR'],2022.0,11.0,Oh Seong-ho,"Kwon Da-ham, Kwon So-hyun, Oh Ji-hye, Lee Han-ju, Gye Young-ho"
877434,206: 사라지지 않는,206: 사라지지 않는,ko,2023-06-21,93,0,0,7.0,1,0.0598,['다큐멘터리'],['SonaFilms'],"['KR', 'TH']",2023.0,6.0,Heo Chul-nyung,
877440,성덕,성덕,ko,2022-09-28,87,0,0,5.5,2,0.0722,['다큐멘터리'],['Haerangsa'],['KR'],2022.0,9.0,Oh Se-yeon,Oh Se-yeon
877443,왕십리 김종분,왕십리 김종분,ko,2021-11-11,101,0,0,0.0,0,0.1851,['다큐멘터리'],['Indiestory'],['KR'],2021.0,11.0,Kim Jin-yeol,"Kim Jongbun, Kim Gwi-im, Kim Jongsoo, Jung Yuin"
877447,피아노 프리즘,피아노 프리즘,ko,2023-08-30,91,0,0,0.0,0,0.0214,"['다큐멘터리', '음악']",[],['KR'],2023.0,8.0,Oh Jae-hyeong,Oh Jae-hyeong
878023,F20,F20,ko,2021-10-06,104,0,0,3.5,5,0.6318,"['스릴러', 'TV 영화']","['Monster Union', 'KBS']",['KR'],2021.0,10.0,Hong Eun-mi,"Jang Young-nam, Kim Jung-young, Kim Kang-min, Lee Ji-ha, Kim Mi-hwa"
878026,브라더,브라더,ko,2021-10-07,97,0,0,3.0,2,0.2966,['액션'],[],[],2021.0,10.0,Shin Geun-ho,"Jo Jae-yun, Jeong Jin-woon, Cho Won-hee, Jeong In-gi, Noh Susanna"
878028,동백,동백,ko,2021-10-21,136,0,0,6.0,1,0.2024,"['가족', '드라마', '전쟁']",[],['KR'],2021.0,10.0,Junyoung Shin,"Park Keun-hyong, Seo Jun-young, Jeong Seon-il, Shin Bok-suk"
878545,예스 평창!,예스 평창!,ko,2018-03-08,90,0,0,0.0,0,0.0503,['다큐멘터리'],[],[],2018.0,3.0,백철기,"Choi Moon-soon, Kim Sang-hyun"
878577,친구 엄마:섹스하던 날,친구 엄마:섹스하던 날,ko,2018-01-18,60,0,0,0.0,0,0.0522,['로맨스'],[],['KR'],2018.0,1.0,이상민,미즈미 사키
878579,노총각 아들과 어린 새엄마,노총각 아들과 어린 새엄마,ko,2021-03-09,52,0,0,0.0,0,0.1438,['로맨스'],[],[],2021.0,3.0,마스킹,
878643,서울생활,서울생활,ko,2014-10-30,20,0,0,0.0,0,0.4857,"['드라마', '로맨스']",[],['KR'],2014.0,10.0,Lee Woo-jung,"Koo Kyo-hwan, Lee Chae-eun, Ryu Hye-young"
878789,"1959년의 김시스터즈 - 숙자, 애자, 민자 언니들에게","1959년의 김시스터즈 - 숙자, 애자, 민자 언니들에게",en,2020-12-01,17,0,0,0.0,0,0.0387,['다큐멘터리'],[],"['FR', 'KR']",2020.0,12.0,Jeon Chaelin,
878974,오마주,오마주,ko,2022-05-26,108,0,0,6.833,6,0.526,['드라마'],"['JUNE Film', 'Little Big Pictures']",['KR'],2022.0,5.0,Shin Su-won,"Lee Jung-eun, Kwon Hae-hyo, Tang Joon-sang, Lee Joo-sil, Kim Ho-jung"
880676,사이렌,사이렌,ko,2021-11-12,90,0,0,4.813,8,0.7097,"['TV 영화', 'SF', '미스터리', '스릴러']",[],['KR'],2021.0,11.0,Ahn Jun-yong,"Choi Jin-hyuk, Park Seong-yeon, Jo Dal-hwan, Koo Ja-sung, Song Yeong-jae"
881441,가치 캅시다,가치 캅시다,ko,2021-10-28,93,0,0,5.0,1,0.1927,['드라마'],[],[],2021.0,10.0,Jo Seung-won,Kang Hyung-suk
881677,탄생,탄생,ko,2022-11-30,150,0,0,6.2,4,1.5351,['드라마'],"['Min Film', 'Alma Art']",['KR'],2022.0,11.0,Park Heung-sik,"Yoon Shi-yoon, Ahn Sung-ki, Yoon Kyung-ho, Lee Moon-sik, Lee Kyung-young"
882580,크리스마스 캐럴,크리스마스 캐럴,ko,2022-12-07,131,0,0,6.3,18,0.7884,"['액션', '스릴러']","['Finecut', 'Union Investment Partners', 'D Station (KR)', ""Blue Plan'It""]",['KR'],2022.0,12.0,Kim Sung-soo,"Jinyoung, Kim Young-min, Kim Dong-hwi, Song Geon-hee, Heo Dong-won"
883957,요시찰,요시찰,ko,2021-10-13,106,0,0,4.3,3,0.4555,"['드라마', '코미디']",['CMNIX'],['KR'],2021.0,10.0,Kim Sung-han,"Oh Dal-su, Kim Jeong-wook, Akira Kim, Choi Min-seok, Kang Kyung-mo"
884034,뫼비우스,뫼비우스,ko,2021-10-13,79,0,0,0.0,0,0.2971,['드라마'],[],[],2021.0,10.0,김영,"Lee Jung-hyun, 공수호, 변지현, 안지혜, Kang Sung-wook"
884139,우리는 천국에 갈 순 없지만 사랑은 할 수 있겠지,우리는 천국에 갈 순 없지만 사랑은 할 수 있겠지,ko,2024-10-16,110,0,0,8.0,4,1.6216,"['드라마', '로맨스']","['T.S Narincinema', 'SW Contents']",['KR'],2024.0,10.0,Han Jay,"Park Soo-yeon, Lee You-mi, Shin Gi-hwan, Kim Hyeon-mok, Geum Hannah"
884418,리얼섹스돌 사용설명서,리얼섹스돌 : 사용설명서,ko,2020-09-08,67,0,0,0.0,0,0.3522,[],[],['KR'],2020.0,9.0,,
884759,"안녕, 내일 또 만나","안녕, 내일 또 만나",ko,2023-09-13,144,0,0,6.8,4,1.6763,['드라마'],[],['KR'],2023.0,9.0,Baek Seung-bin,"Sim Hee-seop, Hong Xa-bin, Shin Joo-hyup, Kim So-hee, Kang Chae-yun"
884819,무덤이 웃기 전에,무덤이 웃기 전에,ko,2021-11-25,60,0,0,0.0,0,0.0071,[],[],[],2021.0,11.0,Paik Jong-kwan,
886430,고속도로 가족,고속도로 가족,ko,2022-11-02,128,0,0,6.4,8,0.628,['드라마'],['AMG Entertainment'],['KR'],2022.0,11.0,Lee Sang-moon,"Ra Mi-ran, Jung Il-woo, Kim Seul-ki, Bek Hyun-jin, Seo Yi-soo"
888032,보는 것을 사랑한다,보는 것을 사랑한다,ko,2021-10-28,75,0,0,0.0,0,0.9743,['다큐멘터리'],[],[],2021.0,10.0,Yoon Kihyung,"Bong Joon Ho, Choi Bool-am, Park Jeong-ja, Jeon Moo-song, Ji Sang-ryeol"
888265,킬링톡,킬링톡,ko,2021-01-01,92,0,0,5.0,1,0.557,['스릴러'],"['Cheong Woo Film', 'Prince']",['KR'],2021.0,1.0,Ryu Gwang Hyun,"Choi Kwon, Seo Bum-suk, Song Young-gyu, Han Eun-seon"
889110,죽이러 간다,죽이러 간다,ko,2021-11-11,95,0,0,5.0,1,0.9777,"['코미디', '드라마']",[],[],2021.0,11.0,Park Nam-won,"Choi Moon-kyoung, Choe Yoon-seul, Oh Jung-yeon, An Ayoung, Yoon Ki-won"
889512,악인은 너무 많다 2: 제주 실종사건의 전말,악인은 너무 많다 2: 제주 실종사건의 전말,ko,2021-11-11,83,0,0,4.0,1,0.9046,['스릴러'],[],[],2021.0,11.0,Harry Kim ,"Kim Joon-bae, 공유석, Ahn Da-eun, 고윤빈, Go Gyoung-hee"
890154,살수,살수,ko,2023-02-22,100,0,0,5.5,30,0.852,['액션'],['JNC Media Group'],['KR'],2023.0,2.0,Kwak Jieong-duk,"Shin Hyun-joon, Lee Moon-sik, Kim Min-kyung, Hong Eun-ki, Choi Seong-won"
890615,숏버스 섬뜩행,숏버스 섬뜩행,ko,2021-10-28,87,0,0,10.0,1,0.0362,"['공포', '스릴러']",[],[],2021.0,10.0,,
890646,숟가락,숟가락,ko,2013-01-01,15,0,0,0.0,0,0.0757,[],[],[],2013.0,1.0,Kang Shinyoo,"Lee Myung-ha, Son Hyeon-woo, Kim Hwa-hyun, Song Kang-wook"
890648,버드나무숲 양림,버드나무숲 양림,ko,2021-10-28,82,0,0,5.0,1,0.0445,['드라마'],['Story Cha'],['KR'],2021.0,10.0,Jeong Seong-hyeon,"Song Young-hak, Choi Yu-ri, Joo Seok-je, Byeon Ji-yoon, Choi Woon-kyo"
890948,스프린터,스프린터,ko,2023-05-24,88,0,0,5.0,1,1.2746,['드라마'],['영화사 만화경'],['KR'],2023.0,5.0,Choi Seung-yeon,"Park Seong-il, Gong Min-jeung, Lim Ji-ho, Chun Sin-hwan, Song Duk-ho"
891749,개구리,개구리,ko,2020-11-07,22,0,0,0.0,0,0.0639,['드라마'],['Korea National University of Arts'],['KR'],2020.0,11.0,Yeonwook Jeong,"Park Ji-hu, Choi Ye-bin"
892323,가리베가스,가리베가스,ko,2005-01-01,19,0,0,0.0,0,0.0725,['드라마'],['Korean Academy of Film Arts'],['KR'],2005.0,1.0,Kim Sun-min,"Lee Yun-mi, Jeong Seon-yeon"
892548,팬텀: 더 뮤지컬 라이브,팬텀: 더 뮤지컬 라이브,ko,2021-12-01,177,0,0,0.0,0,2.0901,['음악'],"['Wys En Scène', 'EMK Musical Company', 'Wysiwyg Studios']",['KR'],2021.0,12.0,Park Jae-seok,"Cho Kyu-hyun, Shin Young-sook, Im Seon-hye, Yoon Young-seok, Kim Joo-won"
892556,슬기로운 불륜생활,슬기로운 불륜생활,ko,2020-01-01,75,0,0,0.0,0,0.0522,['로맨스'],[],[],2020.0,1.0,,
892856,여타짜,여타짜,ko,2021-12-08,96,0,0,4.0,4,1.3707,"['드라마', '범죄']",[],[],2021.0,12.0,Lee Ji-seung,"Lee Chae-young, Jung Hye-in, Choi Chul-min, Kim Sa-hee"
893550,귀토-토끼의 팔란,귀토-토끼의 팔란,ko,2021-11-11,143,0,0,0.0,0,0.1292,['음악'],[],[],2021.0,11.0,고선웅,"김준수, 유태평양, 민은경, 윤석안, 허종열"
894073,핫 블러드,핫 블러드,ko,2021-11-25,100,0,0,4.5,2,0.4925,['액션'],[],[],2021.0,11.0,Sin Jae-myeong,"Choi Je-heon, Choi Woo-jun, Ryu Yeon-yeong"
894235,긴 하루,긴 하루,ko,2021-12-30,100,0,0,6.7,3,0.1691,['드라마'],['HAJUNSA'],['KR'],2021.0,12.0,Cho Sung-kyu,"Kim Dong-wan, Nam Bo-ra, Seo Jun-young, Shin So-yul, Jeong Yeon-joo"
894753,내로남불,내로남불,ko,2020-01-01,0,0,0,0.0,0,2.31,['로맨스'],[],['KR'],2020.0,1.0,,"Cha Myung-Hoon, Choi Do-hee, Sang Woo, Yoon Yool"
894754,스토커,스토커,ko,2021-10-28,73,0,0,5.667,3,0.275,"['미스터리', '공포', '스릴러']",['KRCG'],['KR'],2021.0,10.0,Lee Soong-hwan,"Kim Ga-bin, Yeo Woo-rin, Kim Jung-han, Lee Sang-hee, Yoo Seung Min"
895179,듣보인간의 생존신고,듣보인간의 생존신고,ko,2023-09-06,81,0,0,6.0,2,0.7443,['다큐멘터리'],['Cinema Dal'],['KR'],2023.0,9.0,Gwon Ha-jeong,"Gwon Ha-jeong, Kim A-hyun, Lee Seung-yoon"
895346,싸나희 순정,싸나희 순정,ko,2021-11-25,104,0,0,7.9,4,1.1608,"['드라마', '코미디']",['Ace Factory'],['KR'],2021.0,11.0,Jeong Byeong-gak,"Jun Suk-ho, Park Myung-hoon, Kim Jae-hwa, Choi Dae-chul, Shim Eun-jin"
895571,당신은 학생인가,당신은 학생인가,ko,2021-11-19,79,0,0,0.0,0,0.0071,['다큐멘터리'],[],[],2021.0,11.0,Baek Jin-u,"김민솔, 김재웅, 남궁종현, 배수연, Baek Jin-u"
895713,윤율아씨의 쓰리쿠션,윤율아씨의 쓰리쿠션,ko,2021-10-19,67,0,0,0.0,0,0.1368,['로맨스'],[],[],2021.0,10.0,,
896332,프랑스인 김명실,프랑스인 김명실,ko,2014-06-26,75,0,0,0.0,0,0.1217,['다큐멘터리'],[],['KR'],2014.0,6.0,Yi Ji-hyun,"Yi Ji-hyun, Cecile Delaitre, Koo Won Young"
896355,런닝맨 스페셜 - 게임의 시작,런닝맨 스페셜 - 게임의 시작,ko,2017-01-01,69,0,0,0.0,0,0.0261,['애니메이션'],[],[],2017.0,1.0,Yun Jun Sang,
896457,바다 위의 별,바다 위의 별,ko,2021-07-08,6,0,0,6.5,2,0.0071,['애니메이션'],[],['KR'],2021.0,7.0,Jang Seung-wook,
897160,용감한 시민,용감한 시민,ko,2023-10-25,112,0,2116112,7.361,79,17.3885,"['액션', '드라마', '코미디']","['Studio N', 'Oscar 10 Studio', 'Vol Media']",['KR'],2023.0,10.0,Park Jin-pyo,"Shin Hye-sun, Lee Jun-young, Park Jung-woo, Park Hyuk-kwon, Cha Chung-hwa"
897248,완성과 미완성의 사이,완성과 미완성의 사이,ko,2021-10-16,19,0,0,8.0,1,0.3191,"['드라마', '로맨스']",[],[],2021.0,10.0,Donghyuk Shin,"Kim Young-pyo, Roh Young-joo, Yohan Lim, Crystal Cho Jones"
897656,털보,털보,ko,2019-06-06,14,0,0,6.0,1,0.1979,"['로맨스', '드라마']",[],[],2019.0,6.0,강물결,Kim Pureum
897663,흐르다,흐르다,ko,2023-03-29,122,0,0,5.5,2,0.2816,['드라마'],['M&M International'],['KR'],2023.0,3.0,Kim Hyun-jung,"Lee Sul, Park Ji-il, An Min-young, Park Ji-soo, Jeon Ah-hee"
898557,로그북,로그북,ko,2021-11-24,100,0,0,5.5,1,0.0984,['다큐멘터리'],[],['KR'],2021.0,11.0,Bok Jin-oh,
898581,이상존재,이상존재,ko,2021-12-10,70,0,0,5.5,2,0.0684,['공포'],['Dreamfact Entertainment'],['KR'],2021.0,12.0,Cha Jin-woo,"Yoo Se-yoon, Yang Jae-jin, Min Seong-Joon, Im Woo-il, Yeo Woon-ja"
900013,안녕 자두야 명작동화: 효녀자두 ＆ 엄지공주,안녕 자두야 명작동화: 효녀자두 ＆ 엄지공주,ko,2019-11-22,76,0,0,0.0,0,1.1413,['애니메이션'],[],['KR'],2019.0,11.0,Son Seok-woo,"Yeo Min-jeong, Jeong Hye-ok, Choi Joonyeong, Yang Jeong-hwa, Jung Hye-won"
900014,안녕 자두야 스페셜: 언더 더 씨,안녕 자두야 스페셜: 언더 더 씨,ko,2019-01-25,80,0,0,10.0,1,0.5346,['애니메이션'],[],[],2019.0,1.0,Son Seok-woo,"Yeo Min-jeong, Yang Jeong-hwa, Jeong Yu-mi"
900188,보조바퀴,보조바퀴,ko,2021-11-25,60,0,0,0.0,0,0.0261,['드라마'],['Film Choice'],['KR'],2021.0,11.0,Lee Ju-ye,
901121,거미집,거미집,ko,2023-09-27,135,0,126,6.571,91,2.429,"['코미디', '드라마']","['Anthology Studios', 'Luz y Sonidos', 'Barunson', 'Barunson E&A', 'Barunson Studio']",['KR'],2023.0,9.0,Kim Jee-woon,"Song Kang-ho, Lim Soo-jung, Oh Jung-se, Jeon Yeo-been, Krystal Jung"
901506,그랜드퍼커 회춘할배,그랜드퍼커 회춘할배,ko,2021-04-29,0,0,0,0.0,1,1.198,['로맨스'],['Duricom'],['KR'],2021.0,4.0,PD,"Jo Wan-jin, Yoo Ji-hyun, Kang Jae-yi, Kang Min-woo, Yoon Taek-seung"
903294,깨복쟁이,깨복쟁이,ko,2021-10-21,99,0,0,5.0,1,0.3138,['드라마'],[],[],2021.0,10.0,Kim Hoon-hee,"Lim Hyung-kook, Kang Yeong-il, Kim Si-young, Lee Dong-yong, Jo Myung-yeon"
903416,순영,순영,ko,2021-01-01,26,0,0,0.0,0,0.0214,[],[],[],2021.0,1.0,Park Suh-young,Kang Jin-ah
903788,기우제,기우제,ko,2021-12-02,90,0,0,5.0,1,0.1522,"['드라마', '로맨스']",[],[],2021.0,12.0,Kwon Ha,"Sin Hyun-gyu, Jeon Eun-jung, Song Gil-ho"
903859,"제자, 옥한흠","제자, 옥한흠",ko,2014-10-30,92,0,0,0.0,0,0.6732,['다큐멘터리'],[],[],2014.0,10.0,Kim Sang-cheol,"Kwon Oh-joong, Sung Yu-ri, Ok Han-heum, Young-soon Kim"
903961,여배우 노출 오디션: 삼순위,여배우 노출 오디션: 삼순위,ko,2021-11-20,0,0,0,0.0,0,0.0362,[],[],[],2021.0,11.0,,
904136,특종 기자,특종 기자,ko,2021-07-10,97,0,0,1.5,2,0.4017,"['액션', '판타지']",[],[],2021.0,7.0,장유근,"Lee Seol-gu, Yang Do-hyun, Min Ji-Hyuk"
906153,어나더 미,어나더 미,ko,2021-01-01,73,0,0,5.0,1,0.4019,"['드라마', '가족']",[],[],2021.0,1.0,Park Chan-soo,"Go Gi-hyeok, Kim Jeong-wook, Kim Jung-soo, Kwon Nam-hee, Kim Ji-chul"
906466,꽃손,꽃손,ko,2021-12-02,79,0,0,5.0,1,0.998,['드라마'],[],[],2021.0,12.0,Ryan Kwon,"Kim Ian, Son Sook, Jeon Moo-song, Han In-soo, Lee Joo-sil"
911120,고봉수 감독 단편선,고봉수 감독 단편선,ko,2019-07-31,90,0,0,0.0,0,0.316,[],[],[],2019.0,7.0,Lim Hye-in,"Shin Min-jae, Kim Chung-gil, Baek Seung-hwan, Woongbin Lee, Kwon Ki-ha"
912615,혈적자﻿: 피를 쫓는 사나이,혈적자﻿: 피를 쫓는 사나이,ko,2020-01-01,94,0,0,4.0,1,0.8487,"['범죄', '드라마']",[],[],2020.0,1.0,Lim Jae-young,"심태영, 문상윤, Choi Dae-sung, 성화연"
912727,하녀: 하는 여자,하녀: 하는 여자,ko,2021-05-20,94,0,0,6.0,1,0.5232,"['드라마', '로맨스']",[],[],2021.0,5.0,,"Cha Myung-Hoon, Lee Sang-doo, Min Jung, Ha Jin"
914208,그런 일은 일어나지 않았지,그런 일은 일어나지 않았지,ko,2021-12-30,64,0,0,5.0,1,0.2799,"['드라마', '코미디']",['Contents Wing'],['KR'],2021.0,12.0,Kim Chung-gil,"Yoon Hae-shin, Kim Chung-gil"
915532,On Board,On Board,ko,2015-10-05,6,0,0,0.0,0,0.1399,[],[],['KR'],2015.0,10.0,Seo Won-tae,
915655,비닐하우스,비닐하우스,ko,2023-07-26,100,0,0,6.5,14,1.8489,"['드라마', '스릴러']","['Korean Academy of Film Arts', 'Korean Film Council', 'Finecut']",['KR'],2023.0,7.0,Lee Sol-hui,"Kim Seo-hyung, Yang Jae-seong, Ahn So-yo, Shin Yeon-sook, Won Mi-won"
915736,메모리: 조작살인,메모리: 조작살인,ko,2021-12-29,86,0,0,5.5,3,0.6048,['미스터리'],"['Gulliver Pictures', 'Dreamfact Entertainment']",['KR'],2021.0,12.0,Kim Hyun-woo,"Kim Yoon-seo, Kim Yool-ho, Jeong Eun-woo, Cho Myeong-yeon, Seon Joo-ah"
915742,존경하고 사랑하는 국민여러분,존경하고 사랑하는 국민여러분,ko,2022-01-27,82,0,0,0.0,0,1.582,['다큐멘터리'],"['MBC', 'Mayplus', 'Gwangju MBC']",['KR'],2022.0,1.0,Kim Jin-hong,"Kim Dae-jung, Yoo Si-min, Park Chung-hee, Yang Hee-eun, Roh Tae-woo"
915998,미완성,미완성,ko,2019-02-21,34,0,0,0.0,0,0.0214,"['드라마', '로맨스']",[],['KR'],2019.0,2.0,,"Kim Min Sang, Park Ji Soo"
916122,타이거마스크,타이거마스크,ko,2021-12-30,97,0,0,6.3,3,2.1704,"['액션', '코미디']",[],[],2021.0,12.0,Yeom Jeong-won,"Jo Han-sun, Hwang Bo-un, Kang Byul, Jeong Tae-woo, Kim Heung-rae"
916541,트로트는 인생이다,트로트는 인생이다,ko,2022-01-27,76,0,0,4.0,1,0.5024,"['코미디', '드라마']",[],['KR'],2022.0,1.0,TWO K,"Jang So-young, Kim Kyung-Jin, Kim Sol-bi, Kim Dong-chan, Kim Dae-yoon"
916738,백남준: 달은 가장 오래된 TV,Nam June Paik: Moon Is the Oldest TV,en,2023-03-24,107,0,54093,6.9,8,0.6492,['다큐멘터리'],"['Greenwich Entertainment', 'JBS Arts', 'Seesaw Pictures']","['KR', 'US']",2023.0,3.0,Amanda Kim,"Nam June Paik, Steven Yeun, David Bowie, Yoko Ono, Andy Warhol"
917898,액션동자,액션동자,ko,2022-05-05,102,0,0,5.0,1,0.5507,['액션'],[],[],2022.0,5.0,CHOI Young-min,"Hong Jeong-min, Yoon Sungwoo, Choi Hyeon-jin, Heesoo Ham, Kim Seoyul"
918284,인플루언서,인플루언서,ko,2020-04-12,106,0,0,0.0,0,0.0362,['다큐멘터리'],[],['KR'],2020.0,4.0,Oh Young-Keun,"Lee Yu-bin, Ji Yun-mi, Kang Ji-hye"
918289,길,길,ko,2020-09-03,75,0,0,0.0,0,0.0496,['드라마'],[],['KR'],2020.0,9.0,Lee Ha-rim,"Yoo Geon-woo, Yoo Ah-reum"
918298,유관순과 8호 감방,유관순과 8호 감방,ko,2020-03-05,65,0,0,0.0,0,0.0,[],[],['KR'],2020.0,3.0,Sin Sang-min,
918300,디재스터 라이프,디재스터 라이프,ko,2020-07-01,83,0,0,6.0,1,0.6345,['코미디'],[],['KR'],2020.0,7.0,Baek Ji-hoon,"Song Ji-woon, Park Yong-chul, No Yul, Kim Hye-in, Baek Ji-hoon"
918305,잊지 않았어요,잊지 않았어요,ko,2020-01-01,115,0,0,5.0,1,0.0826,[],[],['KR'],2020.0,1.0,Park Yong-chul,"No Yul, Park Yong-chul, Kwak Seung-il, Baek Ji-hoon"
918308,꼴통 2인조,꼴통 2인조,ko,2020-04-09,81,0,0,4.0,1,0.2236,[],['STORYPOOL'],['KR'],2020.0,4.0,Park Joon-sik,"Cha Ji-hyuk, Cheon Hee-joo, Hwang Yoon Seong"
918311,인 유어 드림,인 유어 드림,ko,2020-06-15,87,0,0,5.0,1,0.8866,['로맨스'],['Joy Company inc.'],['KR'],2020.0,6.0,Kwon O-seong,"Bae Noo-ri, Lee Jong-won, Baek Min-hyun"
918556,계절,계절,ko,2011-10-08,28,0,0,0.0,0,0.0327,['드라마'],[],['KR'],2011.0,10.0,Bae Jong-dae,"Song Dong II, Jang Gi-hoon, Kang Hye Bin"
918769,캠핑촌 아내,캠핑촌 아내,ko,2020-12-17,70,0,0,0.0,0,0.4397,[],[],[],2020.0,12.0,,Yoon Yool
918793,젖스타그램,젖스타그램,ko,2021-11-11,71,0,0,0.0,0,0.1547,[],[],[],2021.0,11.0,,Ye Ri
918928,숏버스 배우행,숏버스 배우행,ko,2021-12-30,104,0,0,0.0,0,0.0261,"['다큐멘터리', '드라마']",[],['KR'],2021.0,12.0,,
919207,서울의 봄,서울의 봄,ko,2023-11-22,141,0,0,7.483,119,2.5788,"['드라마', '역사', '스릴러', '범죄', '전쟁', '액션']","['Hive Media Corp', 'Plus M Entertainment']",['KR'],2023.0,11.0,Kim Sung-soo,"Hwang Jung-min, Jung Woo-sung, Lee Sung-min, Park Hae-joon, Kim Sung-kyun"
919502,잘주는 누나들,잘주는 누나들,ko,2019-05-17,83,0,0,0.0,0,0.7509,['로맨스'],[],[],2019.0,5.0,Chun Sung-joon,"Min Jung, Baek Yoon-jae, Hae Il, 제임스 코완"
921436,탈주,탈주,ko,2024-07-03,94,0,13368094,7.34,53,5.5812,"['액션', '드라마', '스릴러']","['The LAMP', 'Plus M Entertainment']",['KR'],2024.0,7.0,Lee Jong-pil,"Lee Je-hoon, Koo Kyo-hwan, Hong Xa-bin, Seo Hyun-woo, Lee Sung-wook"
921461,2차 송환,2차 송환,ko,2022-09-29,156,0,0,0.0,0,0.2954,['다큐멘터리'],[],['KR'],2022.0,9.0,Kim Dong-won,
921620,굿바이 마이 스마일,굿바이 마이 스마일,ko,2011-03-26,94,0,0,0.0,0,0.2109,"['드라마', '로맨스']",[],[],2011.0,3.0,Jason Kim,"Yoon Seung-ah, Sang-geun Jo, Bae Jin-ah, Kim Jin-geun, Song Yoo-ha"
921623,훈장과 악동들,훈장과 악동들,ko,2011-10-27,92,0,0,0.0,0,0.0143,['다큐멘터리'],[],[],2011.0,10.0,,
921625,스무살의 이중생활,스무살의 이중생활,ko,2012-11-29,60,0,0,0.0,0,0.0256,['로맨스'],[],[],2012.0,11.0,,
921671,전망 좋은 방 - 밀애,전망 좋은 방 - 밀애,ko,2012-11-08,71,0,0,0.0,0,0.0143,['로맨스'],[],[],2012.0,11.0,,
921674,잔혹한 앵글의 로망스,잔혹한 앵글의 로망스,ko,2012-12-13,68,0,0,2.0,1,0.1558,"['로맨스', '미스터리']",[],['KR'],2012.0,12.0,,
921676,방과후 복불복 - 극장판,방과후 복불복 - 극장판,ko,2014-01-01,119,0,0,0.0,0,0.0071,['로맨스'],[],[],2014.0,1.0,,
921677,초아일기,초아일기,ko,2013-01-01,26,0,0,0.0,0,0.0,['드라마'],[],[],2013.0,1.0,,
921680,고시원,고시원,ko,2015-10-30,97,0,0,0.0,0,0.0996,['로맨스'],[],[],2015.0,10.0,,
921683,노인들의 계획,노인들의 계획,ko,2014-01-01,77,0,0,0.0,0,0.0,['다큐멘터리'],[],[],2014.0,1.0,,
921684,얘기해도 돼요?,얘기해도 돼요?,ko,2015-01-01,25,0,0,0.0,0,0.0,['다큐멘터리'],[],[],2015.0,1.0,,
921685,어린인생,어린인생,ko,2015-01-01,41,0,0,0.0,0,0.0071,['다큐멘터리'],[],[],2015.0,1.0,,
921691,한양기방 명기전,한양기방 명기전,ko,2015-12-30,101,0,0,0.0,0,0.7076,['로맨스'],[],[],2015.0,12.0,김민욱,"Yoon Kye-sang, Ha Jin, Yoon Ji-hye"
921692,허장미 사망사건의 전말,허장미 사망사건의 전말,ko,2016-01-01,20,0,0,0.0,0,0.0143,[],[],[],2016.0,1.0,,
921897,섹마녀,섹마녀,ko,2021-03-19,70,0,0,0.0,0,0.1133,[],[],['KR'],2021.0,3.0,,
921911,여비서,여비서,ko,2016-12-22,54,0,0,0.0,0,0.0362,['로맨스'],[],[],2016.0,12.0,,
921942,모텔 302호,모텔 302호,ko,2021-05-28,69,0,0,4.0,1,0.0906,[],['Young Jin Creative'],['KR'],2021.0,5.0,,
922101,신비아파트 뮤지컬 시즌3 : 뱀파이어왕의 비밀,신비아파트 뮤지컬 시즌3 : 뱀파이어왕의 비밀,ko,2019-07-20,70,0,0,0.0,0,0.0431,[],[],[],2019.0,7.0,,
922618,"천년의 노래, 리버스","천년의 노래, 리버스",ko,2022-01-13,60,0,0,0.0,0,0.1094,['음악'],[],[],2022.0,1.0,Sung Yu-jin,
922909,싱어송,싱어송,ko,2022-01-31,101,0,0,5.0,1,0.1661,['드라마'],['Contents Panda'],['KR'],2022.0,1.0,Na O-heon,"Heo Ga-yoon, Yoo Young-jae, Moon Ji-hoo"
923330,수호무적,抗倭,ko,2022-01-13,91,0,0,3.0,1,0.4816,[],[],[],2022.0,1.0,Yihua Xu,"Huang Qian, Kai Song, Qi Xue, Jiang Xingcheng, Yin Xiangying"
923344,다음 소희,다음 소희,ko,2022-11-21,138,0,1350266,7.369,118,0.9466,"['드라마', '스릴러']","['Twin Plus Partners', 'Crank-Up Film', 'Zurty Studios']",['KR'],2022.0,11.0,July Jung,"Kim Si-eun, Bae Doona, Jung Hoe-ryn, Kang Hyun-oh, Bahk Woo-young"
923611,장롱면허,장롱면허,ko,2017-01-04,30,0,0,0.0,0,0.0,['드라마'],[],['KR'],2017.0,1.0,Park Geun-beom,
923612,효자,효자,ko,2022-01-27,116,0,0,7.0,3,1.4432,"['코미디', '공포']","['Dreamfact Entertainment', 'Film Studio Gap (KR)', 'Mog Pictures (KR)', 'Samhyung Entertainment (KR)', 'Sol Entertainment (KR)', 'Value Players (KR)']",['KR'],2022.0,1.0,Lee Hoon-guk,"Kim Roi-ha, Lee Cheol-min, Jung Kyung-ho, Park Hyo-joon, Jeon Woon-jong"
924141,파로호,파로호,ko,2022-08-18,101,0,0,6.3,3,2.923,['드라마'],['Korean Academy of Film Arts'],['KR'],2022.0,8.0,Lim Sang-su,"Lee Jung-ok, Kim Dae-gun, Kim Yeon-kyo, Byun Joong-hee, Gong Min-jeung"
925369,블루 시티 서울,블루 시티 서울,ko,2021-03-04,29,0,0,0.0,0,0.1575,[],[],[],2021.0,3.0,Jeong Seong-Jun,"Kang Gil-woo, Kim Beom-jin, Lee Su-bin, Song Min-hyuck"
925404,모모살롱,모모살롱,ko,2014-09-02,10,0,0,0.0,0,0.0143,[],[],[],2014.0,9.0,,
925682,짬뽕비권,짬뽕비권,ko,2022-01-28,82,0,0,5.5,2,1.4939,"['액션', '코미디']",[],[],2022.0,1.0,Park Dong-Gi,"Baek Soo-jang, Jo Woon, Shin Min-jae, Lee Kyeong-uk, Hwang Ji-yeon"
925686,전투왕,전투왕,ko,2022-02-17,73,0,0,8.0,1,1.5231,['다큐멘터리'],"['Cineport', 'Blue Film Works']",['KR'],2022.0,2.0,Lee Sang-ho,"Lee Sang-ho, Chun Doo-hwan, Woo Sang-ho, Jun In-kwon, Cho Kuk"
